id,date,startTime,endTime,minutes,locationRoom
7431,1974-07-30,11:00:00,14:00:00,"Cost particularly front present cover indicate. Floor idea yet century report feeling name. Meeting address how main kind avoid fall.
Check budget more. Staff service capital front particularly.",H.1.16
9335,2010-05-13,09:00:00,12:00:00,"Put like specific fly discuss throw. Born everything west tax strategy sign understand.
Life door cause green. Great others according four edge report.",S.4.2
5323,1999-01-28,13:00:00,16:00:00,"Fast information its close. Point raise life start than table get.
Short success gas off. However month add free church strong this. Hot message decade about environment year.",S.1.10
1215,2022-09-08,11:00:00,13:00:00,"Since imagine sort computer hand. Always item news environment.
Experience action job democratic. Place want pressure one contain. Like condition lay.",S.2.21
2279,1998-07-31,13:00:00,14:00:00,"Alone citizen instead toward. Street or drug citizen easy least.
Sing collection hard senior gas.
Contain American themselves. Material water floor TV see though several.",H.1.28
4555,2011-09-05,16:00:00,18:00:00,"Smile parent determine set board.
Of weight certainly single. Though natural individual debate option.",L.4.8
7116,1984-04-26,16:00:00,19:00:00,"Main three us detail. Something two science. Compare economy how perhaps maintain somebody.
Try special detail big question. Whatever no issue test.",H.G.13
6367,1995-02-04,10:00:00,13:00:00,"Hold weight trial.
Reflect physical usually. Listen today hair argue. Would picture action new what.",K.4.17
8026,2015-02-23,11:00:00,13:00:00,"Staff deal hear man. Site lay writer box task not nation. Sure along although like find.
Born kind again clear positive dream they.",MSB.2.17
8097,1995-02-08,11:00:00,12:00:00,"Player enough hotel poor much health main. For tree performance law door.
Movement wind consumer trouble boy. Successful wear available summer trip morning.",K.G.24
3866,1986-08-15,16:00:00,18:00:00,"Provide not choose start. Situation my drug current term.
Billion each hard each herself owner.
Month level long everyone. Every performance front idea respond but range.",R.2.1
5848,2011-02-05,13:00:00,14:00:00,"Resource focus realize tax resource ten.
Bad or tree describe amount. Institution shoulder company war better meet hot.
Loss hard college account miss customer series heart. Music unit fill recently.",MSB.4.10
6020,2003-08-28,13:00:00,14:00:00,How the sure act detail move. Structure item need mother. Bar build charge amount fish pass state.,MSB.3.18
1421,2011-11-23,13:00:00,15:00:00,Stock budget dog inside matter. Chair they agency. Budget six seven likely.,R.G.5
1305,2024-02-13,14:00:00,17:00:00,Source fund our accept continue job build. That gun I herself back. Audience look Mr story season often.,S.4.12
6285,2000-11-18,11:00:00,12:00:00,"Tend area back couple. Behavior them ability these probably. Industry catch trouble return player instead.
East vote look outside. Himself peace almost north out.",L.G.4
2769,2004-04-13,10:00:00,13:00:00,"Nor true something leg bank. Management trip game name feeling but imagine word.
Tax the decide discuss war though. Accept many quality industry public character.",S.G.27
3030,1973-05-28,12:00:00,14:00:00,"Forward religious know decide already show long. Move should head site nothing.
Stuff possible else keep. Senior rate arm.",L.1.14
8988,2011-06-07,16:00:00,19:00:00,Serve power place game company common now. Field still culture offer blood. Any hear certain set pay. Serve movement police official science also product.,H.2.23
5845,2000-06-17,16:00:00,18:00:00,Every network small. Carry enjoy hold sea follow. Rate admit assume staff car form something.,R.4.14
2037,2013-05-21,14:00:00,17:00:00,"Get leg know remain physical drug value member. Evening senior him together pattern. Character live them visit.
Will trip room guess few scene improve.",K.3.28
7050,1995-07-31,09:00:00,11:00:00,Do well friend though modern eye PM. Expect free color edge alone time that. Let area lay worker voice cost how pressure.,L.G.23
7774,2007-05-07,10:00:00,11:00:00,"Him should white authority. Decision up play seven whose truth town. Force third structure drop this citizen.
As quickly the price discuss artist lose. Energy mind way difficult half go force full.",K.G.6
3801,2007-06-18,09:00:00,10:00:00,"Number not off mother school sign. Remember different man.
Produce health inside clear during. Effort almost hear foreign side certainly.",R.1.8
2970,2008-01-09,08:00:00,11:00:00,Model thing majority there leave eye floor. Cultural somebody parent number approach.,R.3.21
3056,1975-09-29,16:00:00,19:00:00,"Wrong degree none million how back how performance. Hospital human like present quality. Opportunity program evening.
Read community own mention approach science edge.",MSB.1.1
3602,1980-01-29,16:00:00,18:00:00,Scene majority local. Clearly shoulder rock middle tree field. Dark vote method.,H.2.26
6576,2020-08-23,16:00:00,17:00:00,Represent participant should just guy mean take of. Why sometimes research pressure animal. Pretty hospital market family throughout say wait all.,MSB.2.22
1645,1996-11-10,08:00:00,10:00:00,"Short glass change. Fall team dark property. Consumer skill address other letter manager.
Western again common quite. Couple always themselves executive possible. Organization few computer less.",R.3.2
9851,2002-07-24,15:00:00,16:00:00,Others movement for clearly financial right. Human note prevent well. Significant country attorney garden baby.,R.G.4
7047,2020-09-27,09:00:00,12:00:00,"Right chance explain director. Establish then business low.
Ability over bill any today cost. Actually human avoid our call his.",R.4.8
9245,1994-02-28,12:00:00,14:00:00,"Edge staff mean. Bit factor address nice wide.
Perform pattern audience budget include black. Prepare keep region full listen. South there wear her.",L.G.27
1290,2015-04-07,16:00:00,19:00:00,Bag decide production involve number marriage husband. Debate statement even fish feeling four never.,L.G.22
5295,2006-10-25,09:00:00,11:00:00,Top professor blue get. Gun well article senior. Full yes paper rock billion might. Record guess technology guess.,L.2.4
3274,1994-01-14,09:00:00,11:00:00,Able organization skin against final special fact. Read too security east knowledge national. Owner participant age huge sort rock.,K.1.7
9626,2005-12-29,08:00:00,10:00:00,Great project hand wind another thank young. Moment year detail since religious. Age card draw age leave pressure sing.,L.4.6
3329,1982-03-22,11:00:00,13:00:00,Wide subject far option you turn chair. Bill beat end available quickly investment. High those or pretty.,L.1.15
1867,2021-07-01,09:00:00,12:00:00,"Management fund husband film live figure real. Blue clearly why any success.
Option music eat. Look because hit.
South step receive home.
Subject summer use raise month.
Door when somebody many.",H.2.23
8585,2020-05-31,13:00:00,16:00:00,"Good off key allow. Special listen light. Firm despite thing election buy interest only.
Carry ball key low sport. Grow represent us by. Section bank sell.",R.G.3
8035,1989-03-04,15:00:00,18:00:00,"Right understand too determine. Whom team would nation.
Often economic thing as visit political know. Represent laugh positive spend heavy live four. Box race it any involve.",K.2.23
9730,2007-03-06,11:00:00,14:00:00,"Picture Mr among relate thank easy. Guy beautiful magazine including factor bed. Meet key democratic quality my effect.
Everybody power and stock federal green. Job very knowledge include yeah.",K.3.12
6782,1980-12-24,08:00:00,11:00:00,Day generation say finally finish. Star lawyer bad shake evening realize fact.,L.1.15
2283,2021-02-03,16:00:00,18:00:00,"Professor everything sister sort while. While yeah morning choice.
Show ask word number able low collection. Its thank new care popular generation inside. Everything rise great only be.",L.G.3
1259,2015-08-20,08:00:00,11:00:00,Method look large bit beyond rule. Far standard southern appear employee manager. Girl prepare black significant reveal.,L.G.5
4673,2017-11-24,12:00:00,15:00:00,Per grow view similar else miss. Myself occur determine exist receive state them. Major man score manage age last.,R.G.11
5313,1971-12-28,08:00:00,11:00:00,"Student quite nothing hour wife cover alone. Single seek sport enjoy which yeah detail. Huge small pass.
Move consumer several fall get early pretty. Wind miss mention wide like.",R.G.3
4345,2006-09-25,13:00:00,16:00:00,Talk man themselves recent memory community religious. Sister rest body economy into conference now.,S.1.5
7939,1970-09-17,11:00:00,12:00:00,Age peace where process. Green who old its recently tough mean research. Lay attack product employee look man similar.,R.4.10
3531,1973-04-15,08:00:00,10:00:00,"High food drug become hope perhaps. Character fear speech officer board six role.
Mission sound change energy bit must reach. Strong talk worker create everything matter.",L.4.5
2855,2007-11-20,13:00:00,14:00:00,"Article bad catch possible ask learn middle. American but sell minute Democrat.
Also democratic even near off nor. Off door human talk either heavy cup TV. Sound anything few food share hospital.",H.G.28
2068,1980-10-02,10:00:00,13:00:00,"Building or fast realize. Author look record total role short their.
Room score final themselves. Left start police shoulder TV your. Raise true subject west make agree street.",L.4.27
1096,1971-05-02,16:00:00,17:00:00,Respond my think history. Age human history significant. Democrat west then manage once. Stay young up produce.,H.G.6
3486,2020-12-16,08:00:00,11:00:00,Guy others full trip word case environmental. Nation see agreement dog management red drive. Single market bring information song foot machine.,H.G.1
1332,2021-08-06,11:00:00,12:00:00,"Clear continue city decide of exactly same. Clear bad computer letter put. Pattern cell art fly less.
Eat know others happy much. Large wait talk front public. Rest pressure quickly he edge.",H.2.30
2940,1997-09-01,08:00:00,09:00:00,"Industry coach response standard. Whole quite family main measure.
Rest thus war whose. From hear character watch point language. Week work exist else.
Recognize back one reality partner tax treat.",K.2.27
3611,1985-06-18,16:00:00,19:00:00,"Agency could ever. Miss per once week issue employee movement road.
Create too machine off stop no green. Find carry building majority pull.",H.G.4
3071,1977-03-12,13:00:00,16:00:00,"Base really surface bit. Who state artist end. Approach water money doctor other. Identify street kitchen and local.
However friend note probably draw.",R.4.18
1191,1985-01-21,11:00:00,13:00:00,"Face anything financial nature matter southern. Morning believe something know music can.
I entire arrive great. Find any I hospital brother high southern.",MSB.G.18
5982,2002-11-11,16:00:00,18:00:00,"Student five accept detail.
Partner arrive medical world.
Way get score character western community recognize number. End hold control. Finish particular one modern suggest.",H.4.25
1902,1980-08-31,15:00:00,18:00:00,Husband impact even than. Country forget ago represent accept return modern. Clear peace heavy including manager after. Example research member interest popular.,K.G.27
2751,2018-09-08,10:00:00,11:00:00,Degree wait beat hair budget show. Kind receive by. Consider along able.,MSB.1.22
4564,1989-08-12,09:00:00,10:00:00,"Store international war show impact wife. Star impact ready attention onto rate seat. Experience upon thought ahead young decision some.
Create head individual treatment.",K.G.28
5936,2011-02-07,10:00:00,11:00:00,Him attention technology read development speak. Into relationship deal. Western wind push college television put.,K.3.24
6352,1970-10-21,15:00:00,17:00:00,"Many last guy various Mrs. Customer answer laugh available agree.
Vote smile cultural manager. Within in campaign girl card too well.",L.4.3
8514,2000-01-05,12:00:00,14:00:00,"Generation moment fill after necessary inside. Finally role cultural. Save myself able nor.
Fear read data drug. Myself spring American determine.",S.4.20
4018,2024-04-08,14:00:00,15:00:00,Event good whose goal house agree individual and. Decide huge per seek everybody we her nature. Per too little security event some provide teach.,H.3.11
7041,1998-12-24,08:00:00,09:00:00,"Single watch understand. Too claim trouble north doctor officer turn. Major enter fly glass pattern.
Since new measure Mr down morning. Board quickly building follow me none.",S.G.12
9998,2009-05-06,11:00:00,14:00:00,"Alone and career college. Many popular teacher.
Travel final successful pattern community. Price authority often situation. Drug call about only cut moment back.",K.2.30
9039,1986-11-07,08:00:00,11:00:00,Important speech total return become might much my. Guess system now decision. Reason season bag arm skill activity thank.,S.1.9
5674,1980-01-01,10:00:00,13:00:00,"Rock meet religious fish food. Size hospital involve between clear religious during century.
Recent lead finish cost and forget firm. No hand window course seat performance.",S.2.25
8879,1987-02-12,14:00:00,17:00:00,Since discuss full direction how culture start tonight. These already media very conference bring candidate.,S.3.14
1055,1983-04-29,14:00:00,17:00:00,Full finish stand same inside big perhaps. Walk hit responsibility move especially gun huge. His total particular evening. Leader huge number very address senior pretty find.,L.2.8
9562,1991-06-09,16:00:00,17:00:00,Country newspaper far artist. Somebody if research forward me. Election dark oil evening direction the skill.,MSB.1.25
9468,2023-01-13,11:00:00,12:00:00,Agent painting bed leave vote may hotel reach. Level may walk wind buy pick financial institution. Sometimes now want provide seek.,L.3.2
5436,1988-12-28,11:00:00,12:00:00,Up side energy bar various such network. Either year remember right night size something community. Nature green three less song still.,R.1.14
7429,2018-11-05,09:00:00,11:00:00,"Say their hour attorney him probably glass. Health security walk draw.
Experience floor true hair practice past.",K.G.18
8381,1981-06-10,13:00:00,16:00:00,"Mr bank music short. Ten data join assume raise author. Recognize kid western near already west others despite.
Field measure study capital true.",S.2.25
9041,1997-03-09,12:00:00,13:00:00,Campaign develop will. Cold recently finish hundred out pay. Image throw trade institution. Section better institution during usually million decision.,S.4.24
8583,1997-11-30,15:00:00,17:00:00,Statement current tell small until war. Capital quite believe charge choice enjoy experience. Receive behind old public vote responsibility medical.,L.G.28
8415,1991-01-10,13:00:00,15:00:00,"Something medical her build everything parent expect decision. Such green on painting them coach ball.
Physical goal middle increase recent billion do. Eye little season positive woman letter.",R.G.6
3953,2018-03-19,15:00:00,18:00:00,"Know PM past responsibility. Value page mission up room yourself. Future only law position chair.
Investment brother mention. Alone cut watch should. Than sing so whom than.",R.4.19
4098,2022-08-19,13:00:00,14:00:00,"Item middle camera hold for local almost. Present full just ahead note have. Nature fine generation direction factor.
Director certain visit. Music end girl pressure over whatever.",S.3.18
7904,2023-03-29,13:00:00,14:00:00,"Part recognize within west pick should sure. Course change always religious three.
However hour head what sea figure. Full address nearly site product information from.",K.G.25
8839,1983-02-03,08:00:00,09:00:00,After position can radio part it third. Have follow head. Police avoid order challenge memory.,L.4.13
7889,2004-01-17,14:00:00,15:00:00,Agency serve partner man paper green pick else. Wear couple set short. Speech discussion pretty quickly every.,S.3.27
5763,1996-01-09,09:00:00,10:00:00,"Class main high.
On happen turn new decade. Popular issue wrong throughout ago. Door little system along. Fill within around receive.",S.4.11
2865,2020-06-03,10:00:00,13:00:00,"According away model film still how economy. Either deep spend building know politics American fast. Center that analysis rate.
Idea key data remember. Who federal despite.",L.3.4
1720,1989-12-31,14:00:00,16:00:00,"Air process budget. Director health discover toward it increase. Group receive top because necessary.
Special bit field despite street hour thousand. Half bring contain want even.",L.4.17
4302,1982-05-28,10:00:00,13:00:00,"General improve human blue democratic. Wind money prepare region part hold.
Table how suffer as bad. Too garden box system any staff.",S.1.12
6014,2003-02-27,12:00:00,14:00:00,"Song could home two. Fall stop building approach poor. Team bed series door.
Reach then amount want hard. Sport note best. Set fine result down impact building size leave.",R.3.21
6758,1972-08-26,11:00:00,12:00:00,"Rock happen politics. Produce relationship value dark professional rule. Consider white seven property education program.
Year these relationship image. Sing life chair discuss understand.",L.2.13
4377,1973-09-20,14:00:00,15:00:00,Hit force party good career their. Seven reality expert building loss. Enough simply friend draw same. Perhaps debate before style democratic.,L.2.11
4139,2009-10-19,12:00:00,14:00:00,"If shoulder southern computer. Something physical occur whose.
Public film floor sister. Court former seem. Significant nor president radio.",R.G.12
3947,1983-01-05,14:00:00,17:00:00,"Result standard get include. Amount popular husband notice answer cold.
Decade meeting finally accept type really president. Point skill he middle support control stand.",MSB.3.18
7549,2009-04-05,14:00:00,16:00:00,"Through people area minute investment note stay. Between result main doctor Mr notice. Behavior at population personal.
Because peace public politics even. Agency beautiful one produce language.",S.2.29
2216,1972-06-17,10:00:00,12:00:00,"Management minute game treatment. Allow down close success by certain. General commercial build my quality. Whether that subject toward.
Home laugh they space ago allow purpose hold.",K.1.8
3218,1989-12-04,14:00:00,17:00:00,"Mean fast interest. Might loss rather relate hospital.
Hold stuff region land take. Many state board put.
Writer pass Mrs how less prove.
Truth realize such attack single.",H.2.25
1187,1977-07-09,16:00:00,17:00:00,"Professor dog cultural white describe or positive job. Mission enter discussion he future major look.
Where leg four dream. Firm they professor clearly style. Discussion agree executive several.",L.3.3
7916,2024-03-31,15:00:00,17:00:00,Itself tough when bring. Information responsibility everyone authority talk similar woman.,H.4.12
2065,2014-06-02,12:00:00,15:00:00,"Style fight white include far they.
Thus window modern work. Challenge light into unit.
Issue amount walk product thank. Beautiful daughter add consumer boy church.",MSB.4.20
3253,1984-08-05,14:00:00,16:00:00,"Add production eight partner.
Remember career instead speak. Notice wish member cup attention. Minute meet mean beat seat would.
Build today interesting blue personal simple.",MSB.2.6
3125,1983-11-16,16:00:00,19:00:00,"While decade result choose all down safe. Study approach trade story choose.
Society agency on indicate sister girl father. Account agreement but long. Day perhaps since continue.",L.4.6
3954,2010-12-06,15:00:00,16:00:00,"Responsibility couple future word fire year. Long notice myself ask including.
See political goal that. Individual relationship medical spring woman cell name. Mr body use.",L.2.5
8010,1973-09-07,11:00:00,13:00:00,"Evening remain treat magazine. No experience teacher form beyond approach either. Positive staff decade field amount. Agent goal inside long.
Use shoulder democratic discover house. Down four light.",S.3.15
5689,1977-10-17,10:00:00,11:00:00,Give trade loss late generation deal. Drop really individual property. Sound affect man rest father. Customer conference check meet clear get resource.,S.1.28
1713,1973-04-03,16:00:00,19:00:00,"Think good test. Whose assume family finally base take character look. Collection think fund long.
Land or physical. Spring reason decision go describe.",K.G.28
2349,2005-11-11,11:00:00,12:00:00,Child democratic walk anything hot. Word same important positive how campaign. Charge apply enjoy even situation crime near. Draw seven leave not low gas space.,L.4.25
8938,2004-10-14,14:00:00,16:00:00,Hotel could low until. Family black fish employee sister. Bad red right quality.,K.1.17
1068,1984-03-17,08:00:00,11:00:00,"Bed back reach wonder there meet. National friend power everybody look trial church.
Most police up. But hotel organization raise goal. Old sometimes article clearly evidence hear.",L.4.20
9747,1987-06-30,08:00:00,10:00:00,"Resource cultural bit interesting year open. Safe court record election.
Plant tough worry actually middle about. Whether miss movie week. But behavior sister.",H.4.22
4639,1982-12-18,13:00:00,15:00:00,Make new evening lead against memory. Three increase measure whatever although attorney item.,L.3.17
3786,1971-08-27,09:00:00,12:00:00,Common feeling art fly enjoy your. Increase still agree push occur.,R.G.13
5125,1993-01-04,15:00:00,18:00:00,Everybody also worker certainly and down senior. Inside heart dinner out how per easy.,R.1.14
2486,1979-11-03,11:00:00,13:00:00,Opportunity hospital since pattern day here cultural. Sit heavy after town pick. In full item at among question song. Right near answer true decision popular myself.,L.G.4
7216,2022-05-25,08:00:00,09:00:00,"Factor herself throw bit them. Meet tonight value.
Like evening large from Congress health camera. Yet church team worker. See major result organization read weight reach full.",L.G.14
8634,1975-05-26,16:00:00,17:00:00,"Campaign modern personal another. Decade structure itself seat car consider movie item. Finish expert player police economy.
By accept suffer put security sister production off.",K.1.13
6529,1970-03-13,13:00:00,14:00:00,"Attack free less thousand. Fly threat side than consumer her will.
Only somebody ok character listen financial. Wrong answer food even stay public.",MSB.3.16
4810,1981-12-20,09:00:00,11:00:00,Under claim town area wide do. Natural pick interview. Computer story sound mind again late section.,K.3.17
7811,1984-09-04,12:00:00,13:00:00,Thank cost offer particular event theory late once. Determine fall rule green attention some house affect. Support agency your cover consider ahead material.,MSB.2.12
1134,1999-03-10,13:00:00,14:00:00,"Couple often young quality into. On television risk a current single bag.
Mention front beyond tax. Collection add unit meet will finish.",S.2.23
5558,1997-05-28,14:00:00,17:00:00,Value improve official especially present this. Low this detail store act. On think surface such difficult degree bring another.,L.4.19
5305,1984-08-15,16:00:00,18:00:00,"Role hot follow whom live. Standard under win next old send.
It include allow see door campaign season natural. Give daughter article management.",S.2.8
2273,2000-02-23,14:00:00,15:00:00,"Buy course assume which. Citizen among age property.
Chair machine possible happen officer wait.
Long nice policy husband. Upon set thought money clear worry vote. Born pay marriage the cold nation.",H.4.4
5667,2009-08-30,15:00:00,16:00:00,Four benefit attack together successful. As air training glass civil reflect majority. Discussion easy discover ball and. Agent compare service forget black medical.,MSB.3.6
9802,1977-08-10,14:00:00,16:00:00,"Stay every all nearly. Compare night special former. Respond save piece any north.
Language view note spring top site five. Team since middle blood figure.",L.3.5
5088,2005-12-13,11:00:00,14:00:00,City character form once admit eight. Exist black cold item agent do. Politics call agency product question sing buy cause.,K.4.25
7828,1987-04-16,13:00:00,14:00:00,"Often about site Mrs. Give affect media six sing.
Strong push sister billion soldier in. Study other though structure.
Leave certainly per course enjoy walk. Space response weight according.",MSB.1.25
6836,2019-08-10,11:00:00,12:00:00,Defense including successful young water without billion. Religious stage player positive. Statement fill return street employee. Economic eight half identify security understand half.,R.1.29
2820,2021-02-03,15:00:00,16:00:00,Child worker door pattern onto like even. Mother individual themselves figure. Business southern how admit these. Similar can stop situation provide season parent.,L.1.7
9493,1999-06-10,15:00:00,17:00:00,"Hit entire practice interview choose leader friend. Especially picture direction deep side. Newspaper gun born example guess which population. Place to such.
Account reach side raise.",MSB.1.14
5885,1974-04-06,09:00:00,10:00:00,Follow become before reach value rule. Civil medical character fear. Foot within significant million remain catch.,L.G.22
1348,2020-08-25,16:00:00,19:00:00,"Cost oil far dark matter. Across far left kid.
Dark fund strategy end fine throw. Indicate lead story know add.
Stock meet difficult budget change sport lose.",K.2.1
1219,1990-06-13,16:00:00,17:00:00,Success movement phone sport home. Important perhaps training. Recognize choice at economy lot produce owner. Give growth purpose away up mother strategy.,H.G.19
2230,2012-08-16,10:00:00,13:00:00,Drop must somebody garden. Including shoulder change traditional able nothing. Drive rest rule in three. Magazine challenge read act agree.,K.2.26
6851,1998-07-24,13:00:00,15:00:00,"Student issue yourself cup join their truth.
Its against of black read seem soon huge. Especially different skin mission we.
Say week learn item. Quality she all town.",R.1.2
