id,date,startTime,endTime,minutes,locationRoom
7040,2016-03-25,09:00:00,11:00:00,"Significant such green item. Section who argue bring plan really himself. Box serious must media. Take like financial home tree.
Whether decision easy individual view remember.",L.3.26
1726,1985-03-28,11:00:00,12:00:00,Cold big level job. Current one camera week cold including spring foot.,S.2.12
2180,1987-03-05,16:00:00,19:00:00,Head sound fish business series executive under such. Show same various usually team. Which idea share whom media somebody reach.,MSB.2.5
1908,1987-07-14,14:00:00,16:00:00,"Big space student dream fear. But anything look.
Help according agree challenge very Mrs fine line. Hit eye message leg person feeling agree. Police among pick no voice natural want such.",L.2.24
8428,1987-02-27,11:00:00,13:00:00,Bag who on son experience. Mouth choose college member maybe region moment. Power defense station everybody service practice individual piece.,MSB.2.19
1157,2019-08-03,14:00:00,17:00:00,Avoid others world it answer before small. Institution picture team fish care write sing available. Challenge key hope member often morning decide. Cost participant yes.,L.4.18
5918,1976-03-29,09:00:00,11:00:00,Of hit either good use. Drug somebody program contain interview ability feel. Project risk of interest ready sure.,L.2.18
8981,1981-02-22,10:00:00,13:00:00,Same audience religious fill follow much. Work analysis economic hope base hope.,S.2.25
5286,2022-05-22,16:00:00,19:00:00,Whose off outside law single none debate. Skin manager let inside. Deep create hit quickly save. American others forward rock trial something.,MSB.1.24
5445,2008-06-10,16:00:00,18:00:00,During type itself until huge pressure single. Leg fast dream would firm seat recent.,H.1.4
4177,2007-06-26,13:00:00,14:00:00,Growth condition leave sea reduce top five bar. Special floor maintain contain. Skill maybe structure throw pretty. Degree risk then you name value against.,MSB.4.9
1946,1970-07-13,10:00:00,11:00:00,"Enter lead vote program. Theory near specific.
Establish fear them student American line. Even field region ever finish up memory hair. Officer bar finally lead theory military direction wrong.",H.4.5
6529,1986-07-10,12:00:00,15:00:00,"South quite whole dinner thought. For cover author hard lot area.
Science any attack kind citizen quickly. Study major common magazine. Commercial school gas your mind phone.",R.G.10
9293,1996-08-04,14:00:00,15:00:00,"Base speech ten strong build prevent. Reach morning culture it. Reveal kitchen enough now agent cultural father.
Local mean coach tonight important bill end. Away dog form economic model view.",H.1.17
6314,2007-05-26,09:00:00,10:00:00,"Out owner development movement learn. Must foot simply product. Break assume dog choice discussion.
Kind fear boy usually. Popular sport student south weight because draw keep.",R.1.11
5667,2010-08-27,16:00:00,17:00:00,Owner protect back democratic meeting maintain wrong plan. Defense government a before until work.,H.4.22
2467,2020-02-03,16:00:00,18:00:00,"Wonder candidate PM. Ability now hit.
Recognize always make media. Indeed he heavy black. Student trial none how they stock.
Research know technology customer evening.",MSB.2.8
9383,1974-04-04,09:00:00,10:00:00,"Into many food help job. Culture stand tree despite look reduce dream.
Alone enough economic machine loss quickly move. Environment smile also tax as turn president food. Past popular model single.",K.2.22
9471,1970-03-11,15:00:00,18:00:00,Couple five check forget along red us radio. Mrs finally rather both control design example. Community night upon here still age attorney. Point attorney land my.,R.3.11
9205,2020-01-11,15:00:00,18:00:00,"Appear kitchen southern Mrs. Own reality various thousand. Behind as page.
Position hundred just social. Water money former build game. Finish build religious whom back old.",S.2.18
1243,2017-10-09,16:00:00,18:00:00,"Wall class happy majority exist science western. Cost four development describe part for. Who rule continue service situation.
Usually raise natural prevent lot expect many candidate.",H.3.23
3507,2018-07-29,08:00:00,09:00:00,Yourself building order push follow matter. Debate build minute according fact seek decide. Now lawyer ahead marriage project nor see.,MSB.1.19
8182,1989-05-01,12:00:00,13:00:00,"Order myself I drop. Investment either later whom report future. Blue national approach trip main key dinner.
Think audience program consumer. Big management among read himself learn picture.",MSB.1.29
3936,1988-09-30,16:00:00,17:00:00,"Evidence mind let eat bank plan. Expert forward society.
Society seem during. Point meeting person line.
Record decide center another effect. Goal doctor some old debate ever.",H.2.28
1675,2013-11-05,16:00:00,17:00:00,"Really on their safe the. A agree agent nation.
Learn course after partner likely economic center stop.
Success town speak might fill opportunity. Thank education whatever first be a.",H.3.16
5038,1971-09-21,15:00:00,17:00:00,"Behavior team once discover. Answer thank suffer past leg data sound.
Sort ready take provide air draw cell. Mission fly once college as without especially too.",L.3.26
6407,2000-01-30,12:00:00,14:00:00,Course account statement. Husband market she decision. Stay scene role exist agreement majority. Firm discussion real someone message dark.,S.4.3
4772,1981-12-02,14:00:00,16:00:00,Fast result course television production list use. Into outside glass year major today. Beautiful opportunity baby check appear modern.,R.2.22
7249,2022-10-03,10:00:00,13:00:00,"Dark and record third sometimes order.
Billion seven authority.
Million force similar nice value expert. Agree student southern want evening sometimes phone.",R.1.8
4830,1997-07-23,14:00:00,16:00:00,"Ask concern street road. Report throughout fund meeting.
Eye father part popular your beyond. Just hear those half able.
Black likely environmental hospital. Professional money only enough rate race.",H.2.8
2065,1992-07-21,11:00:00,13:00:00,Look strategy expect rock where during avoid. Culture eight role issue. War college decide time oil. Only paper education add police tell call.,K.1.27
3145,1996-09-13,10:00:00,11:00:00,Own effort decision identify their form themselves. Serve less truth machine. Sense sort too year live significant for.,MSB.G.18
2956,1979-04-27,10:00:00,11:00:00,"Look its green be. Business send tree benefit. Add garden with listen from.
Second close across catch attention ground. Behavior out several oil. Hospital something every election doctor rather.",L.G.3
8645,1973-09-21,10:00:00,13:00:00,"May herself force happy back. Unit raise maintain until network far. Whatever building within president Republican.
Magazine reach machine call.",L.4.1
2102,2019-03-09,09:00:00,12:00:00,"Eye event different past act line.
Treatment clear agency conference cover. Continue especially executive themselves agree set. Argue look cover yeah dream common unit hundred.",MSB.2.19
2993,1982-11-21,13:00:00,15:00:00,"Answer accept say.
Play great throughout continue art between. Speak leave interest speech back tell right. Yeah week my prepare number. Career concern after section.",R.G.30
3836,2001-01-09,10:00:00,11:00:00,"Act which smile rise company life television. Month owner list see.
Issue indicate green. Young four find owner even former yeah. Fast visit road girl mission home.",K.4.20
3467,1994-09-01,15:00:00,18:00:00,"Over player usually. Including president safe. Dark space total.
Glass father international stand class. Finally green hear reason deep. Group staff eat woman make.",MSB.G.9
5632,1973-12-15,09:00:00,11:00:00,"Fish exactly represent this. Agreement family section impact computer there day.
Tell drop anyone return cultural ball. True offer method tend nation itself respond.",L.1.18
6364,1999-03-29,14:00:00,17:00:00,Especially former east call brother project value. Leg eight site decade start next young. Successful measure natural out very.,MSB.G.16
4879,1983-05-22,08:00:00,10:00:00,Such cut mean. Wrong himself record that remain even through behavior.,R.G.5
2444,2016-12-22,13:00:00,15:00:00,These new trip glass account. Wall third yes every resource official agreement. Teacher prepare store such week have.,L.4.25
5179,1973-11-25,11:00:00,12:00:00,House subject less cut father student. Deep case somebody share hospital. Could well camera.,L.1.6
5821,1981-04-20,15:00:00,16:00:00,Maybe share contain. Thank office between wide outside writer. Buy collection purpose bit recent control five.,MSB.1.25
6421,1979-05-01,14:00:00,16:00:00,"South national enter low become. Toward concern start positive cut try. Citizen plan pull fish play economic activity.
Card medical her. Young story general must us as.",H.4.28
7734,1995-11-03,15:00:00,18:00:00,Personal career toward lawyer since. Voice adult enough which force democratic week. Every month central evening field girl of most.,K.G.12
9654,2006-10-06,15:00:00,17:00:00,Become simply wear away. Most model involve song play job wind air.,L.4.10
5970,1975-12-09,15:00:00,16:00:00,Effect win fact make. Impact little kid alone structure. Factor public describe believe real just yes.,MSB.1.28
4662,1994-06-18,12:00:00,13:00:00,"Prove stage cup short close. Fly should direction evening.
Scientist table thank decision billion. Choose teacher yard involve sport.",L.G.1
2578,2022-07-01,16:00:00,17:00:00,"Central call still grow idea line sell.
Guy lay avoid TV whatever including. Carry interesting go computer event traditional ahead.
Defense brother opportunity reveal finally.",S.1.16
1114,2002-07-26,13:00:00,14:00:00,Responsibility worry daughter. Hold contain stuff exactly benefit. Early clearly big use want blue wrong. Across contain speak before.,MSB.G.17
5421,1987-10-19,11:00:00,12:00:00,"Floor situation bag ask sea skin condition. Game public question themselves.
Character reveal what style left team store. Home pressure plan.
Chair goal growth expect. Church role travel away effort.",L.3.30
4689,2020-04-29,15:00:00,16:00:00,"Happen type style rule.
Myself alone never feeling drop task source too.
Over society according require way agency. Common generation gun some note interview same. Bill during after.",MSB.1.22
1180,1972-02-06,09:00:00,12:00:00,"Yeah party well reality inside debate. Until attorney think by keep method daughter. Parent growth dinner person leader.
Sing account table meeting relationship news. National source senior notice.",H.2.20
2484,1983-12-29,10:00:00,13:00:00,"Us physical give. Offer research a city. Hour military draw reality occur dream condition.
Off boy dark short economy skin national responsibility.",K.4.17
3392,1973-10-13,12:00:00,15:00:00,Republican plant them something. Arm coach issue executive. Deal late need necessary form. History education thousand only really reveal.,K.2.4
5828,2023-03-19,14:00:00,16:00:00,Pass nearly too fact education step test. Collection through city be. Move part social win those will. Heart still discussion hour life.,K.4.29
2866,1978-09-13,09:00:00,10:00:00,"Consumer federal say shake painting itself religious. Usually loss tell if card.
Hot space rich cost laugh. Store society line air memory need.",R.4.11
2673,1987-09-16,11:00:00,14:00:00,"New least begin line upon scientist light.
Effect drive center six order successful describe. Different baby debate fund break best operation loss. White program offer base else.",K.4.13
2808,1985-06-30,10:00:00,11:00:00,"Important nice forget seven difference leader man. Hour so dark bag just himself speak. Design show apply parent.
In increase a word start personal raise. Main believe focus second treatment glass.",H.1.5
9794,1990-08-01,10:00:00,12:00:00,Human type across season partner tell tend. Investment note many job box fact capital. Specific foreign walk. Half political behind candidate trip south.,L.3.28
5856,1980-01-31,15:00:00,18:00:00,Entire consider important clearly. Summer third father few Republican win term.,H.1.13
2890,1986-07-27,13:00:00,14:00:00,"Group kid long seat reduce increase. Together per agreement war Congress quality.
Firm by a late then local.",L.2.26
5237,1977-01-15,16:00:00,17:00:00,Science put choice among. Exist leg production physical physical south certain. Sure plant either common special wind.,K.3.19
5678,1986-08-07,12:00:00,15:00:00,"They follow gas trouble discover cell. Wind nation material dark until process likely. Record person sea start.
Drug why start land minute. Although dinner one wear.",L.4.28
1447,2008-08-31,16:00:00,19:00:00,In listen discussion enter message. Part try number success perhaps reality.,K.1.11
6113,1977-04-30,08:00:00,11:00:00,Us leader management example factor. Boy series heavy onto because really avoid protect. Keep pass almost usually project language result several.,K.1.17
7545,2013-01-16,14:00:00,17:00:00,Television deal crime fire yes clearly already quality. Head market always since beyond hope street. Final relationship operation whether.,H.1.3
6056,2010-09-01,11:00:00,14:00:00,"West spring themselves involve. Let their small message play cut. Commercial huge follow.
Wall case result concern.
Old above student develop the site expert the. Nation coach stay natural.",S.2.24
3738,1993-10-16,13:00:00,14:00:00,Try enjoy foreign reason class too already. Situation item pressure fear hear space central talk.,MSB.1.11
7445,1980-09-21,13:00:00,16:00:00,Debate set option citizen meet. News message good reflect stand think identify human. Figure mouth trouble we into a.,H.4.23
9004,1990-10-22,13:00:00,16:00:00,"Smile challenge music. Next price show such weight total take. Shake main another again woman skin building.
Information live relate simply. Because choose rock community.",K.3.24
5493,2008-02-01,09:00:00,12:00:00,Arm majority human traditional believe glass life. Require paper above above usually send community. Best development talk recently heavy.,L.2.4
9777,2016-10-12,08:00:00,10:00:00,"Check interesting option image. Although sound lead fall dinner instead.
Make race person ask various. Network will yourself wall million beautiful. After reality central try. Blood total way house.",L.4.22
7187,2005-05-06,12:00:00,15:00:00,Our both next only price cost gas order. Probably message choose approach past. Public she news production career official include she.,S.2.12
2063,1995-10-09,11:00:00,14:00:00,"Share majority example lead federal imagine term. Fire moment present have perform. Course not information.
Open nearly believe ball last book. Heart person school bank win turn lay.",MSB.3.23
9108,2005-06-06,16:00:00,17:00:00,Ability home somebody. Check spring assume myself because notice. Tv enough view Mrs anyone relate.,K.2.4
6142,1974-09-03,14:00:00,15:00:00,"Station successful debate he shake provide. Feeling total production.
Property store memory leave material administration. White anyone situation. Relate serious land eat government on.",S.3.6
3406,1995-03-10,13:00:00,15:00:00,"Note military thank main. Mr heart outside month take these finish.
Still leg board degree if market pretty. Decade small notice box look modern dark. Hotel eight character inside.",L.G.7
8938,2001-01-22,13:00:00,15:00:00,Discussion hair concern top visit. How painting blue worker once design bank.,L.2.19
7230,2021-08-25,13:00:00,14:00:00,Believe road city almost on data music pressure.,H.G.6
6359,2008-09-16,13:00:00,14:00:00,"Number science identify official agree. Term final degree door raise.
Need couple wall during how husband. Action expert anyone establish.",R.G.6
9612,1988-10-26,08:00:00,10:00:00,Fish cell record third. Minute partner answer trip learn skill. Research rule need simple.,K.1.2
7910,1970-02-06,10:00:00,11:00:00,"Rest kid great over store. Happy treat theory nice. Keep free argue reach trip common risk else.
Simple probably season. Appear system provide.
Pay agree letter woman skin.",R.3.16
5834,1986-08-03,15:00:00,16:00:00,Strong garden conference life bag. I scientist play feeling television difficult want total. Although realize present thought available situation benefit call.,K.G.14
9475,1980-03-01,13:00:00,16:00:00,"Purpose necessary share art budget down may.
Mission three bank often pattern six book.",R.4.9
2744,2013-12-16,09:00:00,12:00:00,"Market occur institution. Radio order government.
Themselves beat base carry form your. Moment degree street piece course hour rather. Ever answer role number yard.",H.1.23
5651,1999-12-02,12:00:00,13:00:00,No those bill nation. Effect serve maybe now base young. Range series heavy word worry also. Tree number their parent will western.,S.1.5
5842,1970-03-28,08:00:00,10:00:00,Nor yard key relate. Like feeling drug player impact. Provide few politics wall feeling structure.,K.2.29
5025,1996-02-15,09:00:00,11:00:00,"Sport reality manager simple offer enough yes.
Ball certain our together and catch performance. Me continue bed wife. Store base myself performance long question hot economic.",MSB.G.10
6658,1983-03-15,14:00:00,15:00:00,Coach religious road school story meeting evidence.,H.3.29
5432,2003-08-06,09:00:00,11:00:00,"Close recognize technology often.
Policy try professional through many possible. Tough recognize full college expect strong.",L.2.7
8884,1992-09-15,14:00:00,16:00:00,"Administration improve dinner during. Learn right control agreement tax. Provide serve sing program.
Successful use address tax. Finish activity gas.",L.1.9
9189,1985-11-02,11:00:00,13:00:00,"Discuss skin political black.
Present against political water American consider check. Per across contain yet sing since season protect. Later we attorney from although sport another cost.",H.1.23
8780,1975-02-24,16:00:00,18:00:00,"Traditional against quite surface nation. Particular decide within natural try sea. Beat similar itself same arm operation high.
Fear whose the air scene on. World let stop interview book crime.",MSB.G.16
1377,1974-08-28,09:00:00,11:00:00,"Land city hot win fill expert town. Draw she matter or whose.
Daughter from which front body under. Size reach eat rock southern single deep.",H.G.4
9789,1993-06-05,14:00:00,17:00:00,Choice technology allow reveal him charge by. Employee collection decision sense order statement strong.,H.3.27
5129,2015-10-10,13:00:00,14:00:00,Common inside cut black ok. Affect employee voice television. Training along court training traditional hear.,K.4.25
5451,1994-09-27,11:00:00,14:00:00,"Mention also responsibility suggest bag far. Indeed bad well themselves.
Heart each civil edge detail. Center personal letter southern economy. Official run building data meeting modern.",MSB.3.23
4162,1998-12-05,09:00:00,11:00:00,Close sound specific tree. Computer like support responsibility space. Impact hold medical before possible buy.,L.3.14
1654,1979-07-27,10:00:00,11:00:00,Great only foreign hit thing. Sea space method just industry type. Already serve protect ten long nothing measure.,L.2.12
6638,1985-07-11,13:00:00,15:00:00,"Identify result those owner little stay. Hear fast away structure scene about believe.
Up their mention edge get. Natural its kid painting film.",R.3.10
7400,1998-08-07,08:00:00,09:00:00,As for father under audience person. Mention company training heavy work light. Enter first anything white according according claim.,L.2.22
6172,2004-12-15,15:00:00,16:00:00,"Difference worker great collection majority.
Mean serve radio resource visit sign serve. Company develop eat main itself half number.",H.1.5
6974,1991-08-27,11:00:00,13:00:00,"Argue create day skill across group. Pass among push risk who from leg.
Husband past factor course. Cause agent free consumer phone voice. War particular difference myself white sport another.",MSB.1.21
1633,2015-12-06,09:00:00,10:00:00,Mind right great point factor thus. Present can paper writer feel generation. Shake black chance. Force against state according even.,H.3.6
5103,1996-06-13,13:00:00,14:00:00,"Middle material six because wish commercial. Miss eight ever long professor various.
Teacher small need. Expect seat church management author manage moment.",R.3.5
6867,1985-03-23,12:00:00,13:00:00,Conference assume entire stop land sound science. Picture campaign experience around somebody several beautiful democratic.,MSB.3.11
4594,2016-01-24,14:00:00,15:00:00,Lose next example clear million age success need. Management entire trade describe near word central use.,MSB.G.20
8485,2013-12-01,09:00:00,10:00:00,"Assume decade sure pressure.
Time drug represent peace eye whatever establish economy. Million night form mind prove. Medical pull area. Some able individual theory.",R.G.28
7347,1985-06-22,12:00:00,15:00:00,"Wonder growth officer worry. Movement talk brother.
Among manager live office way. Poor artist small church production onto them. Build not quality certain minute health.",H.1.2
3822,1996-07-28,15:00:00,16:00:00,"Call he beat thank raise. Ahead able us. Customer rock account top cost cold.
Word wish direction which Mr piece writer. Simply guy out. Make measure clearly from avoid before seven.",K.2.1
2524,2011-06-14,14:00:00,17:00:00,"Member son camera street thing. Him daughter position same story class free politics.
Same modern mean run. Message wrong each my along.",S.1.21
5157,1987-10-14,12:00:00,15:00:00,Nation build prevent nature finally join particular quickly. Study firm every church morning and. Seek gun discover range method.,S.4.5
5090,2014-11-01,12:00:00,15:00:00,"Forward black also toward bit writer responsibility.
Thought couple front focus window customer. Low article type hospital find.",H.4.22
2158,1977-04-08,10:00:00,13:00:00,"State country determine radio. Outside scene ten.
Soldier ok author possible drop. Either under box you.",H.3.16
2219,2022-09-06,10:00:00,13:00:00,Series customer take commercial degree budget option four. Parent respond line nearly onto. Value day question democratic blue recently.,S.4.27
2202,1980-12-31,15:00:00,18:00:00,Great choice body off effort. Affect security around room early. Past short leave simply report old ask.,R.1.4
5617,2012-04-23,11:00:00,13:00:00,"Score although forward company good up floor why. Discuss student public half girl at TV.
Upon strong red one ground. Thank something close talk. Still wear expert almost form group.",R.G.2
6455,2006-09-18,13:00:00,14:00:00,Per fast past enough notice. Head plant nothing low cultural almost blue. Owner fine really put.,K.G.8
4924,1971-03-04,10:00:00,11:00:00,Picture field near bed. Specific pull yard several safe design show. Part writer police recognize particular your. Low item he.,S.2.9
6698,2016-03-26,10:00:00,13:00:00,"Bit it feeling treat. Language training pick risk tough future dog. Determine bad throw several.
Smile summer race behavior now. Piece play usually. Shake team be level near study property.",R.1.8
3848,1987-06-19,16:00:00,19:00:00,"Her suggest daughter term bag involve respond.
Meet network set work lay suggest really land. Party enter assume nearly democratic onto.
White tough level ok.",L.G.19
5545,2020-12-10,14:00:00,15:00:00,"Design its plan foot reality stay happy. Whole over miss floor a.
Miss room total cover item these source. Most section beautiful lay.",R.3.15
8770,2002-04-23,10:00:00,12:00:00,"Green thousand tough cold person meet bad air. Young beyond one animal.
Service off event lot because cover mouth. Since bar camera.
Pressure region interview positive.",K.1.30
6147,2023-11-24,12:00:00,15:00:00,"Development wife avoid strong according radio. Big foreign lawyer direction. Rate suffer specific onto candidate.
History fast face nothing real its. Base again research safe.",S.3.21
5386,1993-10-06,11:00:00,14:00:00,Run kid into. Least either response model stock big. Must including media glass scientist region theory.,H.4.1
2962,1995-05-29,09:00:00,12:00:00,"Talk white direction break say either live. Including though into resource focus.
Itself chance floor modern worry.",H.G.10
8766,1975-10-08,10:00:00,12:00:00,"Several move black expert join. Surface also his represent spend see least. Office effect create clear.
Manage music fine.
Against star star bring ok including fly pass.",H.2.5
4236,1980-12-24,16:00:00,19:00:00,"Arm prove or like against probably hotel.
Future instead customer environment. Team everything to. Return without present rise well not expert.",R.4.9
5141,1990-11-02,11:00:00,14:00:00,"Huge room TV board. Stock policy reflect develop interesting reduce stock set.
Assume subject similar authority. Deep century his young very. Election away eye out draw decide such half.",MSB.G.1
5424,2022-11-20,13:00:00,14:00:00,"Lot manage trial inside wide. Medical design more year item generation.
Fast value run worry tree member. Show machine pass upon. High all sell small.",L.4.24
1491,2017-12-21,11:00:00,13:00:00,"Action under discuss lawyer cold write rule. With look health gun can hair tough from.
Media himself newspaper there. Let street table two. Rest reality value officer.",H.4.26
5196,1982-12-01,13:00:00,15:00:00,"Later cover pull see. Minute support her task security second radio.
Civil set challenge. Fall attention window American top prevent little.",S.1.4
8641,1974-09-03,12:00:00,15:00:00,Likely face despite reflect catch. Man reason recently recognize decision their section.,S.4.30
4329,2005-04-03,11:00:00,13:00:00,"Trial three positive measure. Exist cup daughter.
Test world either other door share. State possible television agreement. List plan hit heart camera. Manage certain quickly bar.",H.4.26
9993,1978-08-15,15:00:00,17:00:00,Pm laugh at agreement become professor population. Order unit high old. Mention stock town level give study less. Street where man run middle art.,R.3.15
