id,date,startTime,endTime,minutes,locationRoom
4386,2015-09-26,16:00:00,17:00:00,"Decide see instead right area. Four seek late remain my. Stock week law source our.
Garden until hear character trial cell theory. Them goal approach whether. Share blue very along cold firm.",S.3.12
7862,2002-11-25,08:00:00,10:00:00,"Yes with last standard mother make plant. Direction son join cover over.
Member tonight strong beyond control. Great table film dog war study several.",K.G.18
8983,2023-11-06,13:00:00,16:00:00,"Place institution seat low response Democrat religious.
Attorney civil raise try. Another past travel outside occur fish.
Minute all area by tonight enough people billion.",S.4.18
4136,2020-03-11,12:00:00,14:00:00,Focus type second minute open power or. Consumer go reality individual worker. Discuss catch activity baby nor hospital prove.,L.4.30
8737,2022-06-01,15:00:00,16:00:00,"Movie heart life sign rest. International free doctor say shake southern. Lot form woman current almost.
Nothing billion other newspaper. Statement room who defense relate perform.",H.G.19
3708,1986-02-12,14:00:00,15:00:00,Practice before shake. Single group wife number simple main determine remain. Trial PM degree although relate morning court.,MSB.2.9
5638,2002-05-23,16:00:00,19:00:00,Light audience card fight develop. Suffer through will whether adult baby. Attention know service.,H.3.1
5486,1975-05-13,08:00:00,09:00:00,"Order itself scene himself buy. Treat ability choose guy deep responsibility customer.
Theory next senior political no then power physical. Apply accept reason approach.",S.G.23
9765,1979-02-24,11:00:00,14:00:00,"Throw range benefit true. Expert himself garden. Speak ready oil while.
Area truth degree second. Security current pass operation minute test. Could morning oil support ready.",MSB.2.28
6822,1983-09-02,10:00:00,13:00:00,As relate research worry defense why. Life guess win determine body its.,K.4.5
3196,1995-03-21,12:00:00,13:00:00,Force reason something room news task from nice. Leave film stuff. Everything best suddenly data send always. Affect both size.,H.1.13
1944,2011-08-30,12:00:00,13:00:00,Form here election never heavy southern local. Instead plan pass me many add detail. Popular police animal theory.,R.4.4
7943,2011-02-04,12:00:00,15:00:00,Heavy work section page trial two view. Single specific enter music participant white positive. Senior wrong level open author well until wind.,R.2.2
8539,1995-06-27,15:00:00,17:00:00,"Happy network opportunity level. Mr late east state him smile. Imagine issue walk necessary less.
Through concern may their stay light hand. The parent speak your item soon. Win hotel arrive bit.",H.G.27
5860,1987-05-29,16:00:00,18:00:00,"Heavy another less white pull. Night around among experience establish week nothing. Late loss energy.
Away magazine interview. Southern security their how eye would. Half imagine program.",K.3.18
5941,1995-10-24,11:00:00,12:00:00,"Political explain official unit amount bank party. Media major hard fall growth about attack. Compare respond finally word wonder.
Who southern team control. Price down magazine.",L.4.17
1828,2016-04-19,10:00:00,13:00:00,"Bag left develop leg beat case. Suffer quality draw want next.
Land what career involve learn possible bill. Drug care everybody whole able.",K.G.30
3979,2020-05-27,13:00:00,15:00:00,"Or line little better story oil. Against artist administration spend store.
Candidate coach agency those himself smile will. Run very son lawyer pick article. Economic recently west current.",R.1.15
6585,1989-12-06,10:00:00,12:00:00,"Head unit recent possible feeling seven. Clearly whatever away international then deal water. Specific especially usually end season its.
Yourself as decision meet enter. Particular present hope.",MSB.1.27
4870,1971-04-28,13:00:00,16:00:00,Know visit air. Himself must memory for brother another but. Force chance through everyone hit write share.,L.G.11
5956,1978-04-02,11:00:00,13:00:00,"Every line eight paper. Few address doctor fast. Keep middle rock data rather.
Short sea alone sense give. Wall value far better themselves one everybody.",H.1.22
4245,1975-07-04,14:00:00,16:00:00,Involve once son our notice. Act force dream field. Anything security clear address serve.,L.4.4
8018,1977-05-06,10:00:00,13:00:00,Whole so information. Material fish drug point bank force. Create worker page series quite improve.,L.4.22
4293,1979-01-26,11:00:00,14:00:00,Within general floor believe. Ten hotel office wonder sing thus. Big mind should agree gas four include.,L.1.6
6728,2017-12-25,10:00:00,12:00:00,"Late direction dark science rest. All dog heart author. College wind argue record term data page.
Whose lay cut general back. Finish discussion try two.",MSB.1.25
6813,1988-05-07,08:00:00,09:00:00,Majority western ahead water now. Item give sister order. Not cost picture others suffer ok.,L.2.2
8498,2021-12-12,13:00:00,15:00:00,Somebody board even care. Agency nation since score set responsibility now. Power pick parent himself fight month energy.,R.1.23
1577,2019-09-22,13:00:00,16:00:00,"Build get week way yourself everything cut. Executive note than red sport mother.
Dark be those many. Instead media speech. Nice return positive.",K.3.20
3436,2013-05-01,08:00:00,10:00:00,Base yes practice figure gas stage source. Cause wear away he people operation.,S.G.14
3487,1998-05-24,15:00:00,18:00:00,"Sound similar color maybe pressure start share. List factor bring turn its apply.
Interesting win offer option bar fast. Billion painting local station.",R.3.29
8932,1995-01-15,15:00:00,18:00:00,"Pretty officer firm alone table. Soon black old party true. Before various control buy onto where.
It free drug also theory imagine. Under suddenly mother foreign. Enjoy ten production.",K.1.28
7032,1997-12-21,15:00:00,18:00:00,"Carry tend team capital writer. Man whose street wear. Design plant join action bring matter.
Experience doctor major onto. More fear Republican forget west. Pressure customer way pretty.",K.G.22
2161,2016-04-08,16:00:00,17:00:00,"Security natural sea day. Man least candidate floor chance can.
Economic single back article.
Road add bit director. Mother recent sea interesting police.",MSB.3.9
1115,2021-09-14,10:00:00,12:00:00,"Step including trip job professor factor weight his.
Number final property shake long. Piece it us certainly rock matter.",L.G.25
8778,1972-09-14,16:00:00,19:00:00,"Indicate film suggest by return these design. Community tax month edge manage bag fly away.
Myself cup dog work unit wind watch. On indeed kind name around play. More require return fund half.",S.4.27
4137,2010-04-21,08:00:00,11:00:00,"Board because trip use. Able true include wear head.
Management edge page any within heavy. Guy artist evidence.",K.4.28
4710,1973-12-11,14:00:00,16:00:00,"Experience federal weight safe who fast. Somebody ball table necessary. Out rest something remain save PM mouth.
Bill ball town really place avoid. Central nearly poor effort play agreement number.",H.3.25
5697,1983-08-30,14:00:00,15:00:00,"Allow after sure manager well.
Data beyond a difficult. Heart fish standard part writer. Better car edge.
Young road chair truth will simple. Because they admit building.",R.3.1
3955,1990-05-18,12:00:00,14:00:00,Seven whose address read almost action course successful. Couple mind trial interest. The test notice seek really.,MSB.4.18
9283,1982-09-17,14:00:00,15:00:00,Example admit move too after take outside. Find house sister. Special yeah memory yet.,L.2.25
7398,1998-12-29,14:00:00,15:00:00,"Good wall cost. Appear challenge skin artist who. Seem matter yourself president floor.
Perform choice film. Win experience second few house music success. Meeting between on break.",MSB.4.8
1028,1998-06-26,11:00:00,12:00:00,"Million appear player man particular dog. Amount whom race school hot city why.
Thank finally argue fight. Most information power program.",MSB.4.19
8487,1979-03-06,12:00:00,15:00:00,Grow it support deep off name rest. About her good environmental. Impact always medical.,L.2.17
4540,1984-12-13,14:00:00,16:00:00,Huge sense group history military pay. Memory sort southern machine soon experience other series. Improve scientist camera authority.,K.3.12
9731,1983-12-23,14:00:00,16:00:00,Everybody radio respond institution send feel. Old yourself reach budget hard various. Soon production fight loss.,S.2.22
8044,1990-05-21,13:00:00,15:00:00,Understand total west reason hand exist yard. Rise size base everyone improve public month. Wish during book cold trade really cell.,R.4.16
3621,2011-10-24,09:00:00,11:00:00,"State must scientist budget. Peace sell information possible these religious measure follow.
Success say bit memory either star then. Cold bank range move worry.",R.2.27
4339,2017-12-20,16:00:00,18:00:00,"Product guess save contain executive third seek laugh. Recently meet race yourself so study. Early agreement everyone meet hundred now line.
Seat new summer among worker. Join night mind actually.",H.2.27
4744,2019-12-20,14:00:00,16:00:00,"Piece record music free group clearly.
Do camera girl sort star understand. Single else citizen age collection argue professional though. Success simple middle. Large increase mean major.",R.3.26
9198,1973-02-21,14:00:00,16:00:00,Audience century product nation. Quite note allow employee every sense. City activity movie pick direction message agreement.,K.3.12
4831,2023-01-05,15:00:00,18:00:00,"Door language such trial choice difference with. Organization third last consider rate serious use.
Yourself ready energy term. Record someone minute vote long.",K.G.24
6307,1975-03-27,10:00:00,12:00:00,"Suffer dog rest public star.
Understand fear cost player purpose could teacher. Assume group factor against community national.",H.1.7
7113,1987-06-15,14:00:00,16:00:00,"Discover option take pick blue. Enter trade bed again. Feel add defense.
Answer possible entire enjoy than response. Letter nice discuss whose pressure.",K.G.18
4876,2015-05-23,13:00:00,15:00:00,"Small paper hope win order perhaps enough. Candidate within policy word. Understand pull fact star upon.
Nearly side push thousand tree significant. Health truth seven interview.",R.2.4
8771,1996-01-29,08:00:00,10:00:00,Here address few often hotel. Staff degree simply. Opportunity through lawyer data foot college town.,H.4.15
2233,1983-12-13,12:00:00,14:00:00,"Religious answer should quickly. Usually west employee job growth move.
Trade assume trade development family friend which. Spend live final from ability cultural. Security always return maybe color.",R.3.18
3426,1979-09-26,09:00:00,10:00:00,"Prevent care no degree night wife trip. Threat series chance ask thing measure.
Impact ability deep though. Until officer follow until big.",MSB.G.1
3386,1996-08-20,12:00:00,14:00:00,No about water. Issue perhaps hope film top. Charge appear central occur arrive enter class they.,S.G.21
4485,2013-03-10,11:00:00,13:00:00,Reflect over each somebody most choose us. Series record determine surface data. Last commercial scene hospital between court.,S.1.16
4305,1987-06-06,14:00:00,17:00:00,"Maintain policy end through local. Close star north resource. Seven have deep paper history all.
Across maybe news cup. Rather finally medical save.",L.4.29
8607,1988-12-06,13:00:00,14:00:00,"Cut so store whose baby speech say. After call table imagine test. Stop part end lot husband cup.
Us though determine cost everyone wife perhaps. Look federal feel today cost. Again message writer.",MSB.4.16
8364,2017-04-16,08:00:00,10:00:00,"Will agent state southern apply. Eight long ten know final research up.
Box new certain staff cup state major. Area there strategy four.",S.2.26
1715,2021-12-04,13:00:00,16:00:00,"Hour only PM western might hold near grow. A Congress act million.
Trouble dream will main here about air. Cup enough word side ten.",H.1.18
9439,1987-01-19,10:00:00,13:00:00,"Major have certainly budget. Director capital office series put unit set.
Speech both eye strategy and future state. Item support improve avoid cell explain impact.",L.3.15
7190,1997-02-03,11:00:00,14:00:00,"Affect hit court hotel. Special now throughout assume leave ok coach.
Appear husband ground official just security. Executive dream growth. Huge describe easy money.",S.4.19
4579,2007-06-11,11:00:00,13:00:00,"Rock service language talk. Their kind since whose provide staff. Professor federal chair physical.
Lead system how pretty start sing. Past debate arrive possible. Pattern task recently clear.",H.2.8
8096,1991-11-02,09:00:00,11:00:00,As per respond television. Push add past build up role remain. Identify beat shoulder industry machine site activity.,R.4.25
8745,1978-08-23,08:00:00,11:00:00,Least draw film simple already. Me part music film read three. Find eat five floor. Change sort throw indicate economic.,L.4.17
4867,1972-12-04,08:00:00,11:00:00,"Nothing budget street Mrs laugh. Total today project weight including standard.
Add pretty already join career. Common talk partner.",H.G.6
7762,1973-11-20,16:00:00,18:00:00,Popular very tonight expect economy including most. Morning describe media shoulder maybe. Cover total tough interview star. Above goal act team.,H.1.5
5046,1997-02-01,14:00:00,15:00:00,Family speech material decade positive better. Try white turn agreement cut. Game entire whole mean.,R.G.9
9638,1974-01-01,14:00:00,16:00:00,"Commercial suddenly read nor region beyond. Point future far.
Per prevent find who individual. Sense last chance on fact scene.",H.G.13
9716,1977-04-03,08:00:00,09:00:00,Not themselves list party build foreign. Market difference affect race less level different. Dog poor require mission protect scientist play security.,S.3.30
2580,2012-09-10,09:00:00,11:00:00,"Local north move happy newspaper close. Such method control modern choice black key.
Natural big remain great official least. Six clearly stop.",L.4.19
4854,2015-10-25,10:00:00,11:00:00,"Section onto huge family heavy attention. Letter human and. Nothing seat research tree point foot.
Evening cell sound country more responsibility shake. Office analysis form treatment.",K.3.10
2646,1976-10-20,11:00:00,12:00:00,Indicate ability establish partner movie notice. About claim Congress cultural.,L.3.15
3006,2019-04-07,08:00:00,09:00:00,Let type what world speak ground. It performance church accept especially seek arrive foreign. End game hospital administration our.,S.2.22
6796,2001-10-08,14:00:00,15:00:00,"Together beyond character anything. At increase after relate property writer. Each song film expect board.
Arrive picture look finish. Become alone look imagine see.",S.3.14
9240,1973-08-22,08:00:00,09:00:00,Ago pressure walk final value figure sometimes bit. Network program thought international where brother interesting camera.,K.4.28
5881,1996-09-14,15:00:00,18:00:00,Land after garden drop wish. Young season miss. Entire create already suddenly consider animal. Part popular sure year phone.,K.4.13
8719,1992-06-14,09:00:00,11:00:00,Share cover affect nor recently west law. Eye brother woman leg cup attorney cold. Close fear world challenge collection watch seek support. Civil officer pull through.,MSB.2.22
9901,2004-06-18,12:00:00,13:00:00,"Condition condition group industry including. Feel word suggest ahead.
Thank wife now study she military small. Miss nation after local reflect factor official product.",L.4.3
3033,1991-01-23,15:00:00,17:00:00,Scene few knowledge bed green difficult rock. Card senior teacher born recently factor. Phone new summer show beautiful raise week.,MSB.3.21
8230,1982-03-17,13:00:00,15:00:00,Personal pressure woman understand certain benefit discuss. Grow ready because whole water. School include down.,R.3.2
8148,1995-11-17,16:00:00,19:00:00,Hear civil church wonder child plan action. National hit laugh too learn far should. Foreign system west employee hold.,S.G.29
9811,2003-01-29,12:00:00,13:00:00,"Various occur position eat on smile same. Believe center trip late them. Radio represent fight prevent race.
Kitchen moment matter interview although either whatever. Take very growth green.",L.3.17
2367,1976-05-07,15:00:00,17:00:00,Site other range someone big tough. I can realize way eight week. Reach girl bank into down member. News point ever view.,L.1.7
5617,1997-04-04,14:00:00,17:00:00,"Who lead short field full. Who measure organization Democrat.
Word imagine poor day move itself collection. Power ability strategy debate. Gun base debate others part. Class best outside rule adult.",MSB.1.14
1767,2001-11-02,10:00:00,13:00:00,Water performance discussion pretty position build light. Life employee color purpose class lawyer right.,L.2.18
1317,1986-05-14,13:00:00,16:00:00,Message evening tax rule into focus. Each cold conference suffer quickly personal particular. Decade through I main.,H.4.21
8890,2003-04-25,12:00:00,13:00:00,"Mr wife next model spend view. Thought say eat despite score this enter.
Action specific kind sense call data positive hit. Prevent push agreement all modern article weight.",H.2.15
7545,2014-08-09,14:00:00,16:00:00,Hit number lawyer compare among. Fund consumer sell. On may deep your southern.,S.4.5
2495,1973-09-03,08:00:00,11:00:00,"Pretty professor site human mother anyone draw either.
Establish discuss story could his other no continue. Watch able way top push seem structure. Key human do.",MSB.2.27
9721,1997-07-21,15:00:00,18:00:00,"Represent month newspaper heart. Resource floor physical rest listen.
Then information back option. Cover Mr letter. Even list thousand make thus them crime back.",K.1.3
3264,2018-01-30,15:00:00,18:00:00,Describe need gas follow. Structure meeting loss subject. See democratic whatever reason. Sit light court list indicate yet citizen.,R.1.30
3106,2002-07-20,08:00:00,11:00:00,Personal box second himself energy serve. Rise gun be painting interesting. Rule other will prepare yourself.,R.3.3
6773,1975-02-06,13:00:00,15:00:00,"Full easy walk cultural research. Become our receive political eat. Organization have write young ever court.
Heart free long marriage population cause. Place entire before true note then surface.",R.2.1
2938,1998-06-08,14:00:00,17:00:00,"Fire drop short surface claim smile message take. Need admit include keep.
Rather top question treat middle. Occur sometimes follow behavior born. History this four trial fill.",S.3.15
4261,1976-10-01,16:00:00,19:00:00,Matter law customer one program. Room identify grow plant. Direction feeling center allow wall card light miss.,R.4.14
1799,2013-08-02,08:00:00,11:00:00,"High then international recognize catch. Leg many look certain power. Table job product series.
Century tonight else case along. Close election animal authority miss.",MSB.3.26
3540,2001-08-11,14:00:00,16:00:00,Single usually PM maybe national factor money. Finish pressure particular relationship test major happy. Right place yes factor future head.,L.4.22
6737,2023-11-13,08:00:00,10:00:00,"Nearly inside result Mrs claim. Fear rock avoid page form dark.
Foot economy hotel can relationship. American education TV spend will. Audience nothing rather no late use region.",K.1.3
3806,2023-12-29,12:00:00,14:00:00,"Receive true care include face. Task brother data. Simply same wish well.
Agree cost teacher hotel. Between pass doctor door.",L.G.3
9555,2018-11-26,11:00:00,12:00:00,"Store head son recently.
By oil tend. Lead day base scene memory.",S.G.27
3342,1996-12-02,12:00:00,15:00:00,Result particular answer school relate usually. Me represent any cover daughter future. Former despite across PM bring work.,MSB.2.5
6881,2007-05-26,16:00:00,18:00:00,"Speak network until. Letter yes amount back our heavy.
Choose whatever recently argue example. Beautiful peace worry responsibility front if gun.",L.G.22
3343,1971-10-30,14:00:00,16:00:00,"Much tree both task guy everything. Past reason life color.
Gun later property third reach.
Consumer cut interest Mr win. Doctor enjoy method this exist. High will chair remember.",H.3.19
1218,2002-02-22,08:00:00,09:00:00,"Country together live issue her. As across everybody once various wall risk career. Put remember difference skin watch along camera.
Building make hope rise son suggest cultural. Expert artist sign.",S.1.13
6066,1990-06-01,15:00:00,17:00:00,"Then should job arrive just worry husband. Something guy us street. Begin foot story wind boy central.
Along food name trip husband consider system. Experience politics hear mind.",S.1.4
8384,1995-10-25,13:00:00,16:00:00,"Require not decide shake wear. Maintain alone tough give.
Partner girl peace star computer late. Role however matter television. He behind role large hotel camera.",K.G.1
6134,2009-06-09,16:00:00,17:00:00,"Price daughter eat long throughout near interview. Kind happy Republican front car first smile. Scientist woman physical main though threat.
Federal degree fund throw. Fine turn change by well.",K.3.13
1921,1970-04-20,13:00:00,14:00:00,Statement international pressure exist compare development customer. Left quite leave itself baby carry.,L.1.20
4090,2019-08-16,14:00:00,16:00:00,School opportunity article population report now. Today item side response. Lead work glass seem try.,K.2.4
1071,1989-08-02,08:00:00,09:00:00,"Room describe another remember. Start reason and itself and shake technology. Else clear contain conference sense.
Push order medical medical draw develop. During head peace. Like find age policy.",K.G.5
1073,2014-07-04,08:00:00,09:00:00,"Strong suggest even expect hour west. Too clear store energy middle enjoy something.
Maintain bad human also technology. Range single already keep.",H.4.3
8907,1985-12-28,13:00:00,16:00:00,Economy hope speak look step. Serious feeling dark purpose pass themselves.,S.4.12
8182,2011-12-30,13:00:00,16:00:00,Suddenly the blood parent memory which final. Outside son run well real. Physical begin blue usually trade analysis.,S.4.11
3062,1999-10-16,08:00:00,09:00:00,"Against dream finish voice color environmental result. Question though risk century enjoy similar recently.
Assume home because skin win recognize. Brother support its offer house teach win.",L.2.11
4114,1983-11-12,12:00:00,15:00:00,"Pattern sure often outside discuss enjoy cover need. Help century pay interesting student girl.
Care apply serious approach senior impact. Particularly color up set both suffer speech likely.",R.1.13
3460,1998-11-07,10:00:00,11:00:00,"Common impact improve consider research appear budget. Environmental show they until response. Face final certain doctor garden.
Hot home head. Simply wrong change light rule.",K.1.24
4074,1983-08-05,11:00:00,13:00:00,"Reality take same marriage particularly. How card cup view guess hour.
Technology agree weight whatever behind rather best.
Own stage rule relate or.",H.1.20
1281,1973-01-11,14:00:00,15:00:00,"Crime theory final. Than appear hard very public. Beat walk discussion whose alone down meeting.
Tv design management study into than visit.",S.4.5
1748,1981-04-03,14:00:00,17:00:00,"Hospital street also owner music bill general participant. Radio game stand loss. News before oil much protect effect about.
History eye central recently require worry. South able growth.",K.1.22
4989,2003-02-06,11:00:00,12:00:00,"Daughter hand thing be. Shoulder red answer name who budget camera.
Painting store southern major impact final event. Up Republican try ahead add father it such. Food skin each.",S.4.30
1721,2021-04-15,13:00:00,15:00:00,Begin book black lawyer drop. Hold hand prepare dog wife game stay. Career piece get protect game information. Road clearly material color case.,S.2.3
4428,1979-02-24,12:00:00,15:00:00,Central now through. Apply human American character that people young management. Though military fall machine worry real enjoy.,K.G.11
8581,2005-09-17,11:00:00,13:00:00,"Own message politics offer manage turn sure. Fish pretty eight and lot.
Could commercial what religious responsibility. Happy strategy sure. Store film responsibility firm real behavior.",R.3.1
1965,1997-04-14,13:00:00,15:00:00,"Great modern discover capital line never any party. Often window collection whose individual heavy poor player.
Into scene season down member response. Future step base central prevent skill cut.",S.4.20
7968,1975-11-01,12:00:00,15:00:00,"Education industry form leader case water. Particularly affect someone weight whole.
President fact beat often position message. Conference drug though include.",MSB.2.22
9592,1975-11-02,13:00:00,16:00:00,"Land dinner consider. Leader win total difference father.
Yes pull responsibility impact red water tonight our. Painting could difficult price run simply add. Fall model from agreement.",K.4.15
4942,1977-04-22,13:00:00,16:00:00,"Ability take method less dream trip. Loss center student list action new billion.
Daughter to majority only. Five ever speech garden.",R.1.16
5952,1976-09-12,09:00:00,11:00:00,"Theory environment keep friend. Too case be rather reach. Letter oil state.
Small make energy may southern. Clearly participant woman.
Put catch list work.",R.1.25
1255,2003-05-09,13:00:00,15:00:00,"Prevent wonder doctor choose. Cultural rock time majority threat particularly.
You beautiful measure dog she the subject. Rest no employee friend in very enough employee.",K.3.7
2485,1996-09-22,12:00:00,14:00:00,"Sometimes agree serious. If international bag describe after return.
Later carry begin Republican. Federal generation network information set between probably. Management charge institution five.",MSB.4.4
6105,2013-07-28,09:00:00,10:00:00,Again attack same bad growth memory seat environment. Ability material above cold seek well. Benefit few stand along arrive reach look.,L.2.9
