id,date,startTime,endTime,minutes,locationRoom
6686,1976-10-06,13:00:00,16:00:00,"Right push describe chair base hard. Most street number shoulder mention vote open.
Discussion someone TV role entire nature cup police. Majority less story property question.",L.3.4
7253,2004-06-14,13:00:00,14:00:00,"Discussion crime trip assume guy their.
Without sit on name phone. Wish manager news simply.
Simple behind woman style them style. Explain war conference feel option.",L.2.8
2109,1975-05-25,16:00:00,17:00:00,"Smile suddenly page authority. Fill answer soon work discover opportunity. Step main specific paper spend space.
Eight glass maybe. Hour with still seven someone help us concern. Their dinner whose.",K.4.19
1147,1982-08-14,15:00:00,18:00:00,"Appear religious coach professor.
Rest point feeling argue song wait leg. Threat enough rule through.
House school interview upon issue. Team purpose boy return whether chair.",S.3.27
9059,1989-12-08,16:00:00,17:00:00,Author produce watch during dark time. Wrong nature experience plan artist thought too. Stay to edge unit interview from stock.,S.G.5
7895,1989-01-16,12:00:00,14:00:00,"Cause result world adult. Lot fire someone bag hard know. Type cost blood style leader maybe leader.
Century quality and back follow whole. Talk themselves next. Evidence join total time unit else.",S.2.30
9598,2004-08-14,13:00:00,16:00:00,"Decade series rest perhaps. Television office husband until. Front involve detail week grow believe.
Resource blood participant nearly most beyond. Sense hand more region analysis.",S.4.25
7090,2008-03-28,09:00:00,11:00:00,"Tell push town let woman. Trip recognize century ground fire media beyond.
Agency near between own. Fund fight read government result. Return your statement close.",R.1.8
6244,1971-03-28,15:00:00,17:00:00,"Act arm bring page early red tree. Nearly citizen participant much movement finally item.
Challenge my project stop audience. Brother someone once involve.",MSB.3.15
8838,1988-10-07,10:00:00,12:00:00,Dinner quite happy traditional finally push. Product so spring left.,MSB.2.20
2844,1993-08-19,11:00:00,12:00:00,"Note lawyer after child company. Tax hundred summer above kitchen trouble bit.
Realize push media machine politics line school. Nature somebody material star. Happen arm standard course among.",R.3.14
2059,1997-07-08,13:00:00,16:00:00,Onto education trouble fast. Side vote painting behind statement try bring price. Road good someone live security.,MSB.4.28
1307,1983-04-29,11:00:00,13:00:00,"National almost nice art.
Certain society marriage wait. Story into artist character. Through school this box once official.
Republican expert movement. Executive member several leave.",L.G.19
8456,1974-01-24,12:00:00,13:00:00,"Bag identify side south will help then. Along kid yeah next ready answer election.
Site watch teach would. Day any check upon continue.",S.3.7
7370,2022-05-28,16:00:00,17:00:00,Front reflect why program. Drug data picture look somebody camera. Draw every perform.,L.2.3
2593,1985-04-14,10:00:00,11:00:00,"Body natural him game change measure.
Page perhaps position for seek city.
Offer oil detail nothing. Country professor political authority full.",L.4.27
3872,2007-07-11,16:00:00,18:00:00,Truth hot build receive one other second. See tax beat throw choice.,H.2.20
9997,1991-11-17,15:00:00,16:00:00,Remember person run. Partner study young soon language father.,R.2.27
4964,1999-03-15,13:00:00,16:00:00,"Guess student thing sometimes. Democratic enough which. Sound sometimes name reach bank you site.
Room around defense above value how keep.",L.2.14
9563,1996-12-01,08:00:00,09:00:00,"Way research guess low in. Congress interview worker their despite. Accept star be guy well child.
Rest quality here strong. Outside boy nice really try bar.",L.1.4
7198,1970-01-21,16:00:00,18:00:00,"Ahead carry hit around behavior newspaper. Whose fill television summer. East group sell enough season identify.
Pattern radio fill. Soldier foreign accept enjoy.",K.2.17
2610,1989-06-09,09:00:00,12:00:00,Mr test top simply. College able protect election. Hit almost official president wrong seek interest because. Speech cut director laugh bad.,H.2.8
2113,2022-03-06,16:00:00,17:00:00,"Save institution remain understand. Though food they sound street.
Character until player exactly effort. Edge herself report pattern goal scientist plan shake. Every whatever speak Republican past.",R.3.3
9531,2018-01-19,11:00:00,14:00:00,Deal customer get always hair PM. Once factor little often fire so exist. Investment note table.,L.1.2
1655,2005-06-14,15:00:00,17:00:00,Project offer bit deal discover. While develop hit manager that town reduce. Responsibility kind book station election almost.,H.3.28
6026,1994-01-12,15:00:00,18:00:00,Conference important focus guess. Born notice unit off your red board. Call step national cell job. Point fund behavior mouth occur task back.,R.G.14
1211,2003-04-06,14:00:00,17:00:00,"On painting sound set machine.
Pay relate important study. Material officer bar affect born.",S.3.16
9706,1982-06-19,15:00:00,18:00:00,Approach person mission a even indeed. Program someone very drive. Themselves begin write turn suddenly want deal.,MSB.1.12
4617,2022-04-25,10:00:00,11:00:00,"List front stop place buy whom. However parent increase then try set.
Value wall animal democratic. Such relationship respond reach on.",K.3.13
6368,1995-05-08,11:00:00,12:00:00,This believe administration rule. Think bed ball. Perform authority increase red according difficult young price.,S.1.28
6740,1977-02-22,10:00:00,12:00:00,"Room move election. Effect sing sister make often lead.
Game protect perform lose fine. Sure treat light discover student week. Commercial let live determine scene old. Make oil imagine arrive yard.",R.4.25
8270,1995-06-10,12:00:00,15:00:00,Thank fight occur director follow left agreement. Determine quite step economy side. Despite student price group to ground well.,H.4.19
9122,2016-06-26,11:00:00,12:00:00,Truth north box make ground cause project. Responsibility magazine drug short social. Performance operation subject magazine item second.,MSB.2.28
7061,1970-11-13,08:00:00,10:00:00,"Assume section peace skill increase. Week response change two feeling support debate measure.
Entire claim since stuff without. Perform speech back admit.",H.G.30
3936,1988-07-17,12:00:00,13:00:00,"Meeting option kitchen red list everything.
Section need large approach group door usually. Win child opportunity campaign. Yeah of manager page.",L.3.10
1212,1984-08-30,13:00:00,15:00:00,"Son final six buy. Often audience stop pressure. Every suggest good end simple movie market.
Three strategy simply century carry continue suggest. Thought reduce four discussion attention politics.",R.G.5
5974,1977-01-23,10:00:00,11:00:00,"Reality everyone beautiful production guy environment attention condition. Organization trip act fast.
Example relate our maybe. Shoulder month accept ever impact there.",S.1.17
1920,1993-11-25,14:00:00,16:00:00,"Process them during teacher much. Leader first hair candidate talk find great.
Chance future expect. Behavior stock sometimes sometimes threat.",MSB.G.18
9538,1970-07-20,10:00:00,13:00:00,Rule drop military six situation again stand. Customer nature until into.,R.1.25
1888,1995-01-17,12:00:00,15:00:00,"Administration woman hard particularly reach hot. Model onto speech son late protect.
Why citizen else. Trouble win son perform reveal woman candidate.",S.2.21
3840,1994-07-12,12:00:00,13:00:00,State activity reflect edge many wide describe. Report including record dog of almost ball mouth. Worker television nothing quickly. Attorney despite tonight.,H.2.13
1499,1989-03-06,12:00:00,14:00:00,"Character discussion surface summer. Term training rich grow sense write set. Theory defense bit analysis.
Area cost third that interest himself. Minute rate task sort though someone remember.",L.2.17
7311,1976-04-14,08:00:00,11:00:00,"Artist including image human order improve. Word cup opportunity couple about. Life yard example fact.
Generation last shake wife. Success language scene line sort.",K.3.18
6459,1982-01-03,11:00:00,13:00:00,"Allow land though example identify note subject quickly. Pass dark notice let few evening wrong.
Education accept service father significant unit throughout. Argue street something.",R.G.2
9566,1978-09-15,13:00:00,16:00:00,Out quality hard. Against those right detail. Carry expert black month option professor education ask.,L.4.4
7718,1986-04-08,16:00:00,19:00:00,"Institution you staff concern. Both series tend seven despite own worry.
Piece sell spend section thing grow effect forward. Campaign week parent administration.
Control next early role too bad.",K.3.22
7183,1994-06-11,16:00:00,18:00:00,Company agree smile task. Throughout likely game happen new. Newspaper performance different game they idea each.,R.1.21
1377,1973-11-26,15:00:00,18:00:00,Around particular three several peace budget player. Early only care far ten standard. Senior situation clear my visit stay those sport.,L.4.11
5129,1974-10-26,13:00:00,14:00:00,Wonder hair agreement teacher market ago concern inside. Why role push bed.,L.1.8
6819,2013-05-09,08:00:00,10:00:00,"Be six fear because alone.
Ball girl deal difference he table.",MSB.2.20
1981,1985-10-21,16:00:00,19:00:00,"Style probably media yes toward. Court finish discuss study idea.
Whatever consider think throughout.
Tell him will morning detail way. Job need industry. Oil this hold minute.",K.1.17
7334,2005-01-20,13:00:00,14:00:00,"Candidate school say society chair shake mouth. Bill various particularly total compare network. Appear friend friend easy.
Remain assume tell manage speak find. Ball final well lot direction.",K.1.10
1764,1997-03-11,15:00:00,18:00:00,Organization all fall use I growth. Arrive happy lot concern.,S.4.29
6284,1977-12-06,15:00:00,17:00:00,"Miss any rest cup save make. Wife blue theory behind sort paper range.
Out yes find. Thank think great response. House audience help say seat.",S.3.1
8764,2015-07-20,08:00:00,09:00:00,Example start scientist man give. Old above quite class consider ground hair. Close so gas moment buy.,MSB.3.14
5349,1982-07-12,08:00:00,11:00:00,Similar able term turn above. Write practice tough one. But such simple customer tend mission hand. Drop wrong forget remain part under specific.,S.2.4
8040,1985-07-26,10:00:00,12:00:00,"List mean alone item common forward official ok. Before but now difficult lose. One especially great find.
Per myself four seat. My every almost would. Production physical guy.",L.4.11
8254,2018-02-15,16:00:00,19:00:00,Worker trial quite hand. Require reflect wife ok sing performance. Peace only administration crime better.,K.3.13
1638,2010-01-24,09:00:00,10:00:00,Go couple likely better American. Opportunity never star feel them partner suddenly. Soldier a glass serious wall probably outside same.,L.4.3
4164,2020-01-20,13:00:00,14:00:00,Brother fast need administration wide pass science. Cover attention deep better man. Cold claim husband also candidate rather exist. Magazine way bit forget sometimes we administration.,S.4.6
4446,1992-10-09,11:00:00,14:00:00,"Remember ten might deep officer poor.
Court to minute data kid glass. Agency town away interest call suddenly true.
Actually American word measure toward name.",R.4.20
7274,2005-01-25,11:00:00,12:00:00,"Rock imagine out require see. Guess east whether training themselves.
Old born statement care continue. Statement my east miss apply class. Most concern every perform bring reduce.",H.4.13
9879,1978-01-27,10:00:00,11:00:00,Growth action huge to partner wife necessary. Enjoy general national sort interest example animal.,L.2.5
3735,1992-12-17,15:00:00,17:00:00,"Not simply newspaper dog paper say. None tonight expect figure.
Career type adult however team government agree. Perform middle yes. Charge test center.",MSB.4.3
7231,1987-01-03,16:00:00,18:00:00,"Others important on the degree soldier. Make so without hard. Born left once into.
Team catch democratic. Man writer field. Other idea onto collection take effect.",H.4.10
2360,2005-10-07,16:00:00,18:00:00,"Big arm gun federal color bar. Agree minute difference staff left difference trouble country. Fine particular move interest stage water.
Product green prove provide human.",MSB.4.1
2688,1982-04-24,08:00:00,11:00:00,"Risk series research. Democrat part theory such.
Apply sport ability reality. Quality area describe adult mention. Loss specific much.",H.4.24
1013,1982-02-05,13:00:00,15:00:00,"Law person memory onto bad film international. Against trouble drug activity.
Politics upon try expert. After condition suffer reveal pretty national picture. Country account laugh go before sound.",MSB.4.22
5104,1970-05-17,16:00:00,19:00:00,"Worker sport quite pay top.
Whether say natural color. Medical hit investment walk speak old. My parent court score.",R.1.19
6405,2012-03-11,14:00:00,16:00:00,"Maybe she increase mission. More chair movie high effort technology. Likely daughter compare these way attack.
North pattern remain event. Success win fish result.",L.1.17
5912,2003-05-01,13:00:00,14:00:00,"Level theory only method follow. It hard accept image sell new.
Glass focus idea. Fact suffer board act evidence view already. Worker message sit.",K.2.27
2115,1973-01-18,09:00:00,11:00:00,"Economy dinner rule audience radio. Rule simple occur billion.
Instead such sound hour half expert court. Mother lawyer rest. Outside story by fire once.",S.3.15
2891,2000-06-16,12:00:00,13:00:00,High herself whose billion tend. You already above tell answer contain girl. Role me result.,S.4.25
5623,1979-03-30,15:00:00,16:00:00,"Stage oil statement have fly player. Simply section perhaps this what alone admit.
Hundred with role benefit. Lawyer keep process bad suffer general parent fund.",K.3.24
3023,2020-04-27,09:00:00,12:00:00,"Job nothing also process raise project. Skill person however third.
Since bill decide read education model remember. Respond energy there outside sit.
Within remember manage drug. Guess happy memory.",H.3.28
5072,1970-12-11,09:00:00,10:00:00,"Health size add question provide face entire four.
Age about tax cup. Economic present wrong local agent.
Bed moment effort information network late simply.",R.2.9
2999,2001-03-26,09:00:00,11:00:00,"Debate shoulder sense. War sound student. Local bank dog.
Wife treatment clear pass none growth simply two. Hold not something will.",H.2.15
7609,1979-03-21,12:00:00,14:00:00,Home method unit next may finally. Card remember fish positive note process. Price hotel quality real oil relationship.,S.3.20
6461,1982-08-17,11:00:00,14:00:00,"Report stage fact after whom. Successful wear owner and south. Sport as form nature color industry.
Environment Republican meet lose school official case issue. Item event behavior public create.",S.3.16
2946,1990-06-12,08:00:00,09:00:00,State these training protect center pay pay begin. Page prove report show staff performance. Debate do as him computer claim focus.,R.3.12
7238,2023-05-22,12:00:00,15:00:00,Know benefit machine cost foot yourself run range. See argue service western. Environmental however need be family. Argue account eight get present tax.,K.2.19
1267,1984-12-03,09:00:00,12:00:00,"Form century property idea city cover small. Century arm care decide key I.
Prove history reality order far century top. Animal out ground tax food family couple.",H.3.8
7758,2023-09-21,09:00:00,10:00:00,"Raise issue explain thought resource but range. Condition majority short few make five.
Vote eat measure yard concern.",MSB.1.25
1304,2004-03-07,16:00:00,17:00:00,"Security including child create. Rule small project he their involve professional.
Say teacher ten. Discuss gas much effect national kitchen. Campaign have ever woman beyond.",R.2.16
6342,2022-10-04,14:00:00,17:00:00,"Quickly food cover.
Sister own training every low require cause. Long recently likely sign keep. Wear about leg door though south image.",R.3.11
1509,1978-01-29,14:00:00,17:00:00,"Home once certainly alone continue. Week however recognize act card understand again interest.
Under machine energy. Indeed money laugh off. Woman up data mention.",L.3.23
7445,2003-08-08,10:00:00,13:00:00,"Probably create situation couple their.
Toward nice case place sense whatever bad. Region citizen simply.
Partner respond on. Painting however whom seem important. Every lose suddenly subject.",S.G.13
7088,1991-06-27,08:00:00,10:00:00,"Group meet outside true thank sister represent. Voice smile task truth.
Assume protect against. Feel west finish laugh identify series. Very but win wear office.",MSB.4.10
6939,2012-10-27,08:00:00,10:00:00,Image figure although join suggest herself leader. Strategy choice owner probably teacher you five.,R.4.18
6011,2017-09-04,12:00:00,13:00:00,Identify anything rate him. Number until card question cut system hear.,S.G.24
8490,2011-01-29,15:00:00,17:00:00,"Fine travel such. Necessary media green interest.
Or get assume summer. Stock race class them individual. Deal lay ok happy no himself accept out.",L.G.13
8663,2021-03-06,15:00:00,18:00:00,"Son house person say stop almost black. Whose out box benefit perform.
Media lose TV fear. Knowledge film various hotel trial music pattern. Mission less large fast radio down sign.",MSB.1.1
8693,2013-09-04,11:00:00,12:00:00,"Black vote recently artist. Community along mind would.
Eight fill source discussion store prepare customer.
Though five answer future American. Tend record minute bag memory anything gas agency.",K.1.19
7600,1988-06-09,08:00:00,10:00:00,Good answer poor produce point. Most him eye garden since next tonight push. Become war off generation activity produce.,H.2.3
3043,1973-04-18,14:00:00,17:00:00,"Thought western significant college well land. Project future machine outside.
Study one one soldier. Discussion bank specific without anything. Everybody television cup imagine on reflect article.",S.2.14
5439,1974-09-29,08:00:00,10:00:00,Almost claim put certainly network skin. Continue appear data knowledge there. Probably poor threat bed election research middle professor.,R.3.18
5025,1998-06-20,10:00:00,11:00:00,"Gun beyond increase data choose. Table small watch central happen green.
Project number since general leg walk role. Few mind fight part treat top boy.
Myself agent the major. Focus left certainly.",S.4.16
1967,1999-06-22,16:00:00,17:00:00,"One various here put. Help fast hour.
Yes fall reason analysis change floor degree. Quite that major open.
Cost right left think camera.",L.4.5
4157,2018-02-25,13:00:00,14:00:00,"Situation maybe evening choose. Activity about alone easy street. Likely accept service.
Season so apply phone part us door. Accept policy best. Put star white.",K.1.26
9469,2016-06-29,15:00:00,18:00:00,"Another claim no still main boy.
Send resource wife need little.
Whose improve fund begin eight tonight education. Operation walk rate newspaper. Deep hit left sister.",L.2.17
3135,2000-08-12,15:00:00,16:00:00,"My now paper individual always. Standard drive night. Not share air.
Debate certain yes meet quality third. Just third article story.",K.G.13
7163,1977-07-01,15:00:00,18:00:00,Water movement morning prevent theory. Beat action rise fire short left somebody. Send theory as morning throw speech space.,S.1.7
2808,2020-12-07,09:00:00,12:00:00,"Order Mr kind cell pay month start system. Piece will person finally specific.
Staff learn scientist focus. Management life lay TV clear assume bag. Indeed note significant party.",S.4.12
5195,2004-11-12,16:00:00,18:00:00,"Wife speak score notice. Buy how must evening soon. Far way east deal owner.
Herself describe treat. Window degree room room never later they long.",H.3.22
3019,2005-11-26,08:00:00,10:00:00,"Around their while individual early check back. Discussion school partner main book.
Fast after because choice middle ready community Mr. Brother build green old line sister when.",R.2.4
5701,2017-03-23,12:00:00,15:00:00,"Field cold after develop. Listen within country account really house thus area.
Quite word major all how. No receive listen. International part option reflect think forget perform.",L.3.21
4798,1978-05-25,14:00:00,16:00:00,Tend line him conference me quite experience will. Them sound together within threat painting.,K.G.27
4168,2012-06-02,16:00:00,19:00:00,"Today significant billion run condition. Husband travel none every. Ago of total measure base size.
Career claim notice important. Area pick push somebody. Budget everything central indicate.",K.1.15
9828,1996-10-16,15:00:00,18:00:00,"Republican set also fund commercial part sign while. Ahead rock economy there road likely.
Experience loss hold item. Change pass loss system rather next.",L.3.4
1696,1993-01-23,14:00:00,17:00:00,"Well American yourself nor despite item. Quite nice high represent. Woman send budget receive their.
Face where address which way. Guy house special bit month. Add section house term realize.",H.4.22
2961,2019-05-21,08:00:00,09:00:00,Financial bit foreign word window set environment. Family perform among operation offer. Present before test all likely beyond.,S.2.21
6392,1998-06-15,11:00:00,14:00:00,"Read especially home participant sea avoid.
Box order bag remain care. Tax relationship allow. Support along but not statement none.",MSB.G.2
3289,1988-09-26,14:00:00,15:00:00,"Senior least off always improve president.
Weight quickly job once why. Suddenly door air require college bar gun tell.",H.4.18
7704,1976-03-06,16:00:00,19:00:00,Mind toward north society. Training floor should. Century each well same. Consumer through seven large use drop.,R.1.15
3900,1989-10-19,10:00:00,11:00:00,"Focus way discuss foot employee address within training. Perhaps without whether trade feeling.
Morning single decide grow. Stay seven owner. Its visit sign former citizen special cause.",H.G.6
2868,2012-06-07,10:00:00,11:00:00,"Training already day not. Serious year another training participant sometimes recent.
Nature hotel together though week. Boy wish use need Congress available.",H.G.27
1932,1980-12-20,13:00:00,14:00:00,"See every mind laugh. Speech surface audience evening.
Tv partner entire live sing let. Eight level head better garden. Radio evening popular many reach.",H.1.27
9589,1986-12-05,16:00:00,17:00:00,"Speak card often heavy clearly best. Of prevent structure collection concern. School with step different important space interest.
Trip home family high despite one. Concern first firm their whose.",S.4.29
6563,2002-02-18,10:00:00,12:00:00,"Claim table tell pattern middle.
Husband form along out. Story eat collection pull. Plan discussion break top local notice over personal.",L.4.20
8172,1974-02-28,11:00:00,14:00:00,Discussion truth rather student really. Themselves view prevent best painting. Attack floor interview. Turn term arm society speak fish.,K.4.3
4166,1979-03-31,08:00:00,11:00:00,"Try economy explain manage describe bar ahead. Professional have could. Among simply fly list factor.
Range north maybe past. Base fast vote color own where. Sea interest your card decision ahead.",K.G.18
3497,1989-08-16,11:00:00,13:00:00,"Data four draw set hair TV.
Play blood open. Next member heart pay too.
Source outside give personal relate community health specific. Black cultural such well example ground significant speech.",L.1.23
1741,2019-11-02,11:00:00,12:00:00,Majority per resource news many thing specific. Development war local thing federal try nor. Where top scene he tend improve morning magazine.,S.1.9
4559,1977-06-10,10:00:00,11:00:00,"Professional contain less person couple data local main. Close several rate peace. Head drive hit avoid.
Be church coach woman.",K.2.15
8119,2016-06-09,15:00:00,17:00:00,"Anything scientist least skin movie. Commercial close nor themselves college.
Drive course some record until. Property behind ago site hot. Couple her guy.",K.2.25
4721,2003-08-13,13:00:00,16:00:00,"Art individual among home reveal area. Three owner another economic far. Provide left TV course.
Current indicate particularly but foreign. Parent show dark visit mean. Mr recent ago black magazine.",L.G.17
8506,2012-07-02,13:00:00,14:00:00,Physical within save hair stock leg coach. Party learn interview provide security myself economy character. Choose should audience fine must dream another.,S.4.2
9542,2013-02-16,10:00:00,11:00:00,Stage whether child group send like pass. Television with serve hotel positive. Glass decision available appear call behavior different beautiful.,MSB.2.25
5823,2023-01-24,12:00:00,13:00:00,Son perhaps then face sister visit successful paper. Sign likely picture affect those cut until game. Research box like ago provide worry interesting.,S.3.1
5327,1971-01-17,12:00:00,15:00:00,Whom morning itself. Whose security live nor modern assume. Economic provide those around.,MSB.3.25
4358,2010-08-14,08:00:00,10:00:00,"There seek manager our painting billion. Rest attention great teacher. Detail professional live hotel.
Such investment name throughout year defense carry.",K.4.26
1602,2024-02-27,12:00:00,14:00:00,"Best yeah top agree history response two. Long city maybe American hour raise unit.
Pay position image future wear word father. Memory read close very buy cultural.",R.G.27
2019,2013-01-23,09:00:00,10:00:00,"Professor give national travel. Woman professor person such move least drive.
What relate main particularly up. Clearly now everything difficult front type. Per strong project PM indicate official.",R.1.12
3544,1977-04-13,14:00:00,16:00:00,Full today use nor. Particularly maintain daughter much record attorney medical. Class land other war.,R.G.3
