id,date,startTime,endTime,minutes,locationRoom
1139,1972-11-10,16:00:00,19:00:00,"Generation others region several green several concern. Air now him mean challenge meet water.
Talk behavior history if between. Say white ability hear instead sport.",S.1.16
2510,2019-06-09,10:00:00,13:00:00,Safe decide operation suffer entire TV rich. Base early direction teach lot get. Produce myself official read career major be.,L.3.4
4949,2001-03-17,10:00:00,13:00:00,"Just fast second process. Black sign performance black.
Its Republican structure. Again enough kitchen organization few. Into north crime modern positive. Brother small learn organization.",S.1.13
2314,1978-06-22,16:00:00,17:00:00,"Break property policy amount factor message. Involve than almost draw whether. At set beyond hard less happen without experience.
Wear data Mrs eat suddenly along car. Bar card various human.",H.4.10
4320,1979-04-03,13:00:00,16:00:00,"Could wrong budget dog social suddenly. Drive time Congress girl trip animal. Area white financial require area.
Team north condition area nor health. Base energy or dream behind reveal fall.",L.G.30
6826,1985-09-28,11:00:00,13:00:00,"Lay reality name center.
Because indicate range international market. Southern director wrong sit general.
Personal customer movie ground stand free ask. Treat add ground must manage view thus care.",L.1.13
5110,1998-04-15,11:00:00,13:00:00,Fire gas trial beautiful consumer. Store interest fish on morning fund world paper.,K.G.23
4349,2006-01-18,09:00:00,11:00:00,"Determine majority social opportunity. Another factor natural song local.
Reality now capital movement. Of world build religious. Lose help man grow measure.",R.4.11
7346,1980-12-10,11:00:00,14:00:00,It pay art use poor early really. Outside future option short.,S.3.11
8788,1970-01-15,13:00:00,15:00:00,Learn sound executive base growth. Head claim apply like dinner level language out.,L.2.9
1854,1984-03-21,08:00:00,11:00:00,"Home trial indeed view blue economic ago. Type how charge piece.
Visit option mother identify store family parent. We might explain establish light. Fly yeah cover agent early young window with.",H.G.30
1822,1985-12-18,12:00:00,15:00:00,"Better voice about mission thought. Anything least every upon remember summer.
Statement house voice. Left question election send see new can.",L.3.17
3953,1974-04-18,15:00:00,16:00:00,Big song front nature animal drive generation. Peace manage decide future somebody wall. Yard ball society spring stock goal.,K.3.20
2869,1996-08-03,13:00:00,14:00:00,"During perform agent site. Account how billion prevent hold.
We blood couple make mind buy according.",H.G.11
7447,2007-01-10,11:00:00,13:00:00,"Certainly try person learn. In economic TV challenge question. Establish require central everybody follow rule. Office whose onto every.
List decide everybody pattern project brother let truth.",S.2.9
8767,1973-10-21,12:00:00,14:00:00,Any although interesting put rich. Cultural raise dinner series baby. In growth anyone operation.,S.2.22
1673,2020-01-13,16:00:00,17:00:00,"Behind window resource off security head. Social system son network analysis story fly.
Peace military field such. Employee teach arrive travel. Mean environment total test.",S.3.19
7359,2001-04-09,10:00:00,12:00:00,Others future perform tonight try century morning. World bill between event debate seem strategy. Training station education wonder pattern need very.,K.G.17
5553,1995-07-01,13:00:00,14:00:00,"Election American letter. Outside finish you administration world measure take.
Center machine arm ten including quality. International meet group local.",MSB.4.20
7626,2000-11-03,15:00:00,17:00:00,"Education choose total point. Case store everything listen in.
Including military through issue floor subject west.",H.4.11
6217,1971-10-21,08:00:00,11:00:00,"Success nor east significant. Relate guess close type interesting. Parent cell technology.
Even likely new in world region. Watch seem week morning visit when.",L.G.7
5337,2004-10-11,10:00:00,11:00:00,"Nature kind or name idea beautiful citizen. Their administration throughout mean employee.
Until theory check near trouble buy. Despite analysis fly. Common ever least full.",S.3.20
9978,1984-11-15,15:00:00,18:00:00,"Sea speak shake evidence worker meet less. Trade market situation house maintain design.
Security TV a. Market win end today event recent.
Year response piece toward.
Billion term check.",H.G.8
5562,2019-07-23,09:00:00,11:00:00,Thus officer become Republican believe. Show affect include tax general. Race customer choice wait bill season. Avoid girl program later.,MSB.2.10
5769,1974-03-01,14:00:00,17:00:00,"Effect take as suggest road fight.
Beyond new thus.
Enough scientist fish former near.
Third agent appear career. Might lose continue thank whose back make.",H.3.27
5883,2000-03-07,15:00:00,16:00:00,"Specific around material man. Record past water oil every.
Offer something special into series deep. Let indicate especially finally then strong. Do Democrat relate wish write team available.",K.4.25
2290,1991-06-30,15:00:00,17:00:00,"Employee range sea matter attack trial. Town show develop. Perhaps big plan protect rise benefit. Future especially agree contain medical of often.
Notice after mention. Play care when million.",S.3.28
9712,1990-01-30,10:00:00,13:00:00,Dark against avoid season cost plan. With issue letter throughout Mrs nature Mrs. Actually raise whose tell brother onto.,MSB.2.20
4341,1985-10-06,09:00:00,10:00:00,Professional deal federal foot never. Store opportunity where carry defense ground free. Watch feeling result card though turn.,L.3.12
8105,2007-09-27,11:00:00,13:00:00,Seem enter fact listen. Teach case owner free Mr administration either. Half person maintain method.,S.2.30
8549,1986-07-14,11:00:00,12:00:00,Understand writer offer exist manager century parent. Ready technology world customer may. Affect central seek guy.,S.G.20
9184,2002-07-05,13:00:00,14:00:00,"Training cell director increase future choose good bit. Decide year go anyone president everyone. Wait explain cup experience only accept card.
Air than sort population close compare whether plant.",K.1.3
9180,1973-02-05,16:00:00,17:00:00,"Light fast purpose away article occur. Determine street home worry move clearly.
Often since story today. Country industry industry house fly everything.",R.G.24
6457,2016-05-12,11:00:00,12:00:00,"Century maybe expect. Foreign time drop couple seven.
Practice suffer truth these. Everyone imagine song yet wind car.
Watch dinner determine simple plan tonight. Bit many team enough man book.",MSB.2.18
7153,1978-07-11,08:00:00,10:00:00,"Put capital guess allow. Conference friend truth real blue floor. Stock feeling nice least return skill.
Hand sort into go be coach standard. Often option trip respond service.",MSB.1.30
2585,2007-06-03,10:00:00,11:00:00,Leader then vote thousand station. Home poor week player into organization front. Traditional hand total source scene goal right.,H.1.25
8052,1977-05-26,14:00:00,16:00:00,"High so politics truth consumer various end.
Level window pay team nearly room. American without consumer number talk writer. Market campaign policy eight real.",S.4.30
7463,2014-10-15,14:00:00,17:00:00,"Something main value. Particularly west explain keep others. Moment must when since.
Tree model take rate relate forward great. Each down tend. I benefit suffer less black pick common.",S.2.23
6128,2000-08-17,16:00:00,18:00:00,"Democratic Republican performance main. Ever military foreign.
Sound building girl. Push record heavy per involve several tell. Guy law single feeling fill. Rather artist foot light.",MSB.G.7
6458,2003-08-31,14:00:00,17:00:00,Enjoy floor hit base another there. Adult this statement individual. Wonder movement edge collection throughout discussion control.,K.3.17
6276,2017-05-02,13:00:00,14:00:00,"Free cold later my national current.
Apply total term sound reduce investment. Happen name travel prepare vote heart.
Bad outside simply hand. Meeting gas design certain whom different.",S.1.26
4028,2009-06-18,13:00:00,15:00:00,Because smile far. Off commercial none.,L.2.5
4336,1976-04-17,11:00:00,14:00:00,Part bag executive foot save box. Him yeah even yourself. Teacher artist woman federal every at human.,L.4.21
5763,1988-07-19,16:00:00,19:00:00,"Doctor spend upon establish sound sense. Not while easy involve country treatment. Green customer human bring economy yeah.
Hair candidate into citizen. Time must question through.",S.4.11
5919,1991-01-20,09:00:00,12:00:00,"Identify show skin perform. Reason age of fine item power. Anyone floor but recognize play.
Open design society age maybe. Minute force get color the. Real always push start marriage none list.",MSB.G.5
5725,1986-04-29,08:00:00,11:00:00,Difficult crime tree wall Congress need agency ability. Would you create official herself. Blue behavior tough glass agreement feel street international.,MSB.3.11
6857,1994-12-12,11:00:00,13:00:00,"Series science international door.
Both rather together bit military scene consumer.
Man number deal item property poor ok. Probably from still fact great. Director itself about drop.",L.1.28
9878,2011-04-09,12:00:00,13:00:00,"Worker commercial possible social about. Economy our to score deep. Letter economy growth see.
Air language cold black rate product whether. Stage each between. Part several six.",S.3.12
5859,2018-07-29,10:00:00,12:00:00,Arrive room natural her suggest seat daughter. Just or suddenly fine manager. Movie happen serious herself.,MSB.1.13
8466,1983-03-10,10:00:00,13:00:00,Data environmental Democrat direction. Himself half federal will point. Your win oil material.,L.1.12
5140,2007-03-30,16:00:00,19:00:00,"Financial build relationship security car board. Onto there kid.
A she blood lead I heavy land. Thing try learn for technology finish hard side.",H.3.7
4857,2001-03-19,11:00:00,14:00:00,"Strong it between effort. Above citizen reveal about.
Individual whatever nice school. Kind they blue. Region usually boy itself represent system strategy.",MSB.G.8
7747,1989-01-12,09:00:00,11:00:00,"Two across understand. Almost somebody couple although.
East firm suddenly admit it scientist key. Maybe notice agreement successful cause.",K.3.27
5543,1975-01-22,14:00:00,15:00:00,"Article black foot. Decade minute fear view capital common. Or writer alone moment security after.
Total although ball to including her. Big have kind person walk good.",S.3.17
3028,1981-10-22,15:00:00,18:00:00,"Family stuff detail personal raise theory.
Attention perhaps newspaper. Nice fill current expect again while modern. Above produce administration two course soon.",R.1.22
6292,1970-08-22,08:00:00,10:00:00,"Professional interesting go now. Place among find trip we ask. Attack attack campaign follow resource structure. Smile central security change side remain industry.
Realize sound measure that.",L.4.2
1392,1988-08-15,16:00:00,18:00:00,War health wife society lawyer explain history. Early remain quite allow. Sing artist street risk contain. Government speech and upon area network.,K.3.8
4063,1985-08-30,09:00:00,11:00:00,"Manager already state should above quality. White Congress watch forward fish may.
Save be loss level society. Nearly same us site suggest deal outside. Young figure result you.",H.G.10
9765,1995-04-27,14:00:00,15:00:00,"For soldier single rate. My serve smile under affect memory. Most more whole all able reach best.
Simple north could article range gas science. Region commercial experience building.",H.4.14
4824,1997-02-22,11:00:00,13:00:00,"Threat compare imagine democratic. Expect eye purpose soldier. Probably magazine cell third more.
Cost rise charge. Edge seven place many room consumer language whatever.",L.2.15
3110,2009-02-25,09:00:00,12:00:00,"Former red democratic vote. Direction industry any.
Happen sure use nature former Democrat fine. Deep chance recent. Analysis lose important member.",K.G.16
7983,1976-02-05,12:00:00,14:00:00,"Of culture trip bad network receive eight. Check no buy cultural.
Soon prove state task. Cost safe bad.
Leg camera plan alone minute thought. Himself explain usually cut occur themselves simply.",L.G.12
1770,1976-06-30,15:00:00,16:00:00,Everyone message town commercial. Which collection common because become second sister. Himself pass coach someone morning travel.,S.2.3
6053,2013-09-25,11:00:00,13:00:00,"Challenge film traditional compare local save field project. Service few international these. Piece wait guess among easy customer.
Anyone add last season. Pull media here effort economic.",K.G.12
3039,1990-08-03,11:00:00,14:00:00,"Center name tax level according rule cost. Court pattern consider involve wide lose.
Upon part make. Since cover you system performance huge education. Design toward car per similar.",R.1.11
5384,1974-08-24,12:00:00,14:00:00,Charge official realize let or purpose standard. Especially east away officer minute whether. Around indeed agree whole.,H.G.23
5588,1981-09-14,14:00:00,15:00:00,"Smile public song while both buy. Process sister site somebody kid pressure school.
Appear its woman. Career thing structure school seek pay book.",L.2.18
7079,2012-02-17,10:00:00,13:00:00,"Bit second trial it. Production condition half adult put board though. Last head yourself PM happy husband administration.
Successful send quality war maintain control. American Mr answer do.",K.G.26
2007,2010-06-04,14:00:00,17:00:00,Fight six want her process car. Type city end indicate by door these.,L.2.3
5635,2006-01-23,11:00:00,12:00:00,"Stop let show social white. Type practice cup available trouble pick science.
Yourself water listen culture price everyone. Democrat business land improve within allow. Rise book hundred local.",S.4.14
3106,1970-09-09,16:00:00,17:00:00,"Region thousand fire rich southern so positive. Also what agent assume.
Develop social establish actually one piece money key. Something according moment win community.",L.2.7
4648,2022-07-30,13:00:00,14:00:00,"Safe sometimes maintain season. Suffer opportunity reality wonder night. Poor determine today short.
More happy score its red. Good impact five for commercial partner. Specific hard sell doctor.",H.3.27
6346,1992-02-24,09:00:00,10:00:00,"Those hour the another very strategy pretty. Truth political involve or this the.
Employee husband best mother hotel great. Might significant key answer person bag. Evidence bring bed especially.",MSB.1.16
7452,2005-02-02,15:00:00,16:00:00,"Population build thus meet rather personal. Pay through while baby.
Pull training person. Suggest west surface evening. Happy change also energy.",MSB.G.4
2803,2006-04-30,09:00:00,10:00:00,"Street price increase still will. Wrong before require official receive pick.
Force likely gun particularly pattern choose explain scientist. Great different various point number relate.",H.4.23
1797,2002-01-15,15:00:00,17:00:00,"Culture trouble cause television. Accept performance animal course door stage miss.
Day class candidate record not likely glass. South imagine include figure stay try citizen. Morning show second.",MSB.3.10
1858,1993-12-11,11:00:00,13:00:00,Organization student coach table pretty image leg. Detail growth full stop environment quickly.,L.4.29
7720,1973-05-28,11:00:00,14:00:00,"Age discussion argue stuff important. Old think sure let. Page space after.
Unit party trip minute idea action. Current exactly plant born.",K.2.21
9516,1978-03-08,12:00:00,14:00:00,Professional air minute behavior laugh artist. International management usually today either. Job behavior evening little common statement structure hand.,H.1.12
9958,1997-08-12,09:00:00,11:00:00,"Heart message kid military message actually themselves.
Expert necessary measure suggest eat none market. Different never town newspaper music brother standard.",L.4.23
6862,2023-11-29,16:00:00,18:00:00,"Might camera improve sell difference condition instead.
Modern indeed need eye heavy offer program. Role us hear.
Hand watch table speak describe.",H.2.26
2291,2008-10-01,08:00:00,11:00:00,Ahead never safe hear. Change daughter Mr reveal watch. Pretty beautiful every produce. Both family employee protect beautiful mouth can.,MSB.3.15
5346,2001-10-03,08:00:00,11:00:00,Represent option similar yard defense newspaper hit hard. Notice draw into avoid our certainly election world. See then court color old. Window always behind range day.,MSB.3.5
2717,1992-10-05,12:00:00,14:00:00,Many discover step offer. Financial available series democratic.,K.2.25
9378,1977-05-06,12:00:00,15:00:00,"Have capital successful feeling college push. Store serve from something attention if trade.
Put result scientist fight condition.
Physical a rich college. Home discuss next body enjoy.",H.3.28
3122,2006-01-04,16:00:00,19:00:00,"Speak account forward. Join technology structure. Six although stand until send.
Position peace back crime would. Particular show seat edge color person order.",K.1.6
3979,1990-12-31,11:00:00,14:00:00,"Look lose walk central watch child. Court bag foot future them fish.
Tell light federal into throw brother.",R.G.7
6873,1983-02-02,16:00:00,17:00:00,Least eye money quality explain long site. Sit season type tough professional agency.,R.2.10
2390,2003-07-24,11:00:00,13:00:00,My majority sure whose school star. Forward sort food similar light employee. Security trouble group. Enjoy remain left officer air section.,L.1.3
2448,2005-08-08,10:00:00,13:00:00,"Whom sing sell especially foreign world. Radio when check minute own area.
Modern certain political likely.",H.4.11
5843,1977-05-10,08:00:00,10:00:00,Senior give fine serve be. Blue age whose account institution. As hard throw wonder official hair.,R.1.9
4078,1980-04-29,16:00:00,18:00:00,Do church better interview. Risk road too city. Picture born miss score Congress especially out. Impact service manage change item step explain picture.,R.3.4
8622,2004-09-23,16:00:00,17:00:00,"Computer through serve a. Camera one pull truth radio.
Personal care church this risk. Arm still fast allow. Might someone sort car lawyer what ball.",S.4.12
3218,2020-03-21,16:00:00,19:00:00,Gun the national impact right become. Begin light threat rate upon. Fall consumer order subject recent. Idea purpose prevent.,H.2.27
3414,1999-07-15,12:00:00,14:00:00,"Manager my name husband can fall. New Congress force citizen bit.
Wall finally maintain weight you. Spend some allow number appear throughout really. Attorney positive budget arrive general try.",MSB.1.28
1159,1988-09-12,12:00:00,14:00:00,"Subject argue rest task.
Effort teacher course tree. Until hot exactly. Know movement change try situation.",MSB.1.21
4874,1997-06-13,13:00:00,16:00:00,"Various move do glass. Cost population our none.
Hit past save yard. Student word chair eight that suggest. Eye through only ten.
Time that hair certain nature. Despite occur with establish.",MSB.G.14
5808,1990-12-17,09:00:00,11:00:00,Budget cup guess method prepare education finally. Let price billion skill economic Republican. Teach unit name phone crime him enjoy rest. College the participant big shake plant value.,R.G.14
6061,1976-03-13,11:00:00,14:00:00,"Stage right mind member religious newspaper. Sea system wish.
Sea during such somebody.
Clear catch adult hundred. Should should throw fact.",MSB.G.8
1175,2006-08-21,13:00:00,14:00:00,Middle skill fly customer dinner here end. Game different suffer collection south purpose that.,L.4.23
8519,2008-05-14,10:00:00,11:00:00,"Explain wear opportunity. Let who light decide end. Make include teacher stuff I sometimes.
Fund professor writer discussion.",K.G.27
7964,2005-08-14,16:00:00,18:00:00,"Officer position spend put among. Weight thought it gas above sea despite light.
Enough wide nature a lead arm raise six. Left you one side.",K.4.7
7829,1989-07-07,12:00:00,14:00:00,"Agent she top under ask step want itself. What fill consider culture manager actually bed network.
Assume name rate modern. Matter act daughter thus myself. Send nature note certainly.",R.3.29
7891,2014-08-03,13:00:00,15:00:00,"Between gas born thus may test. Maintain imagine sea throughout north.
You behavior item today final news data. Sea fly officer investment me enough project. Half whether right large place hard.",H.G.27
7182,1990-04-11,08:00:00,10:00:00,Watch whatever response past. Check responsibility material how design employee trade. You officer research security mean share charge.,L.2.5
7222,2011-05-05,14:00:00,15:00:00,Ahead toward mention board condition rest hair. Enough task together off possible positive water. Above mouth shake total believe kind down.,K.4.11
8988,2008-07-16,12:00:00,13:00:00,"Picture give happen laugh image think bar. Class dream suggest.
From it water both require ahead. Reach material necessary west.",R.G.26
5016,2004-08-22,13:00:00,14:00:00,Feeling special surface alone significant kid. Boy school nothing fine might else investment south. Hold clear close sell.,S.2.3
5277,1998-09-21,14:00:00,16:00:00,"Central system expert form social fish. Outside attorney defense amount summer despite.
Reduce owner war smile party throughout huge nature. Cold little rule can.",S.4.28
1171,2024-04-05,12:00:00,15:00:00,"Into floor out age. Art could debate.
Speak learn instead expect decision relate. Memory though behavior week. Hold more grow shake vote.",L.3.5
8956,2007-08-06,16:00:00,19:00:00,"Far various candidate car great identify size former. Law draw stock hope Mrs.
Tree less thank walk everybody media a. Protect president throughout firm you light he. Voice cost need two.",H.4.13
6915,2000-06-23,08:00:00,09:00:00,Pressure test young class heart specific worker. Security throw right never similar. Describe recognize provide third parent lot marriage want. Tax suddenly natural nature long enough defense.,L.G.7
1283,1997-12-18,08:00:00,10:00:00,"Modern group guy can single figure. Feeling use tax seem training collection still.
Interest still enjoy action. Heavy traditional person blue state. What too doctor than son.",MSB.G.10
4189,2014-09-08,08:00:00,11:00:00,Gas and section bring expert quickly sister. Quickly again town. For toward mention then official certainly recently.,S.3.30
2141,1993-09-07,10:00:00,12:00:00,"Language skill close see special college amount play. Line letter town everyone majority across response against. Accept crime six court store.
Home early artist. He career fast.",MSB.2.2
1889,2006-05-17,09:00:00,12:00:00,"Long key several window serve. Allow wide environmental specific themselves most.
Group create treatment travel material. Box debate least between yard. Discover to visit American family spring.",MSB.G.22
4707,1996-06-11,11:00:00,14:00:00,"Deal parent individual child clearly. Wind sure better hand heavy. West late why.
Cause though bit four positive threat floor. System hold admit hotel. Tough actually tonight.",S.3.3
5152,2005-03-02,11:00:00,14:00:00,Especially including Mr paper summer network. Treatment over culture society.,S.3.28
7196,1978-05-18,13:00:00,15:00:00,"Player stock high move myself what specific. Majority skin certainly. Teach network brother better large commercial.
Read unit gun stop voice worry listen training. Federal actually recognize this.",MSB.1.6
3017,1985-09-27,09:00:00,12:00:00,Sign happen whole study cup. Current quality present probably.,H.G.24
5559,2022-04-23,10:00:00,11:00:00,Option project remain laugh employee. Road everything energy result sister music computer. Seem doctor born fall trip recent it.,K.4.9
5015,1989-07-02,11:00:00,14:00:00,"Better reduce week apply maintain consider. Another week firm anything. Than they many address.
Still recently begin above threat. Small check its assume floor them model.",MSB.G.11
5939,2003-12-15,15:00:00,18:00:00,"Billion paper on. Total according health gas billion around.
On party pattern animal cell. Probably crime happen shake.",L.2.1
8389,2007-02-23,09:00:00,11:00:00,"Shake including TV it. Trade lawyer moment interest.
Animal seek husband statement certainly difficult game. Future partner choice success.",L.G.6
3463,1991-09-07,11:00:00,14:00:00,Race eat sing listen third crime seat. Hard magazine center raise. Forward happen participant fact respond value simply.,H.4.30
6548,2008-11-16,10:00:00,13:00:00,Authority ask majority rise buy far baby. Company Congress either leader join man.,K.3.22
8244,1982-04-02,14:00:00,15:00:00,"Television inside smile save network well. Girl control member front ready. Fill room could. Piece meet available college trip.
On who moment mission consider. Yourself lawyer must.",S.2.1
6161,2017-11-06,09:00:00,11:00:00,"Yet provide wrong gun. Data begin throughout mission. Support military plant produce travel room hit.
Moment present bill professional run. Age it near walk story will American participant.",H.4.4
7166,1998-03-24,15:00:00,17:00:00,Couple mission great. Bag success middle their note training. Rich management west for truth act mean. Final despite under hope approach agreement.,S.4.15
9874,2007-07-28,15:00:00,18:00:00,"Later finally even rest. Ahead sea stuff. Become career gun plan.
Win answer hundred generation picture financial spend. Race across all student wall door during.",S.3.21
2105,1993-05-18,11:00:00,13:00:00,Accept indeed city walk tax. Talk level watch it fight him relate. Development artist kid ago.,R.3.1
2248,2018-03-10,09:00:00,11:00:00,"Call happen front. Evening add should page whether because involve Democrat.
Remember pick network physical need interest kind.",L.G.27
6186,1993-03-13,12:00:00,14:00:00,"Dog end care report career maintain necessary. Condition reveal training. Record place act physical worker technology.
Someone remain body large.",MSB.1.28
